Product;Category;Price
Cerveza Apa IMPERIAL   Botella 1 L;Bebidas-con-alcohol;1.001,59
Cerveza Cream Stout IMPERIAL   Botella 1 L;Bebidas-con-alcohol;1.004,95
Cerveza Ipa IMPERIAL   Botella 1 L;Bebidas-con-alcohol;1.004,95
Fernet Speciale VITTONE Bot 750 Ml;Bebidas-con-alcohol;759,49
Vino Blanco C/Tapa Toro Ttb 1 Ltr;Bebidas-con-alcohol;1.020,10
Vino Tinto C/Tapa Toro Ttb 1 Ltr;Bebidas-con-alcohol;1.020,10
Aperitivo PRONTO   Lata 473 Cc;Bebidas-con-alcohol;490,39
Cerveza Cautiva Rubia SALTA 473 Cmq;Bebidas-con-alcohol;495,04
Cerveza Porron QUILMES 340c;Bebidas-con-alcohol;364,00
Cerveza Bot Dorada Origina Brahma Bot 710 Cmq;Bebidas-con-alcohol;775,12
Vino Blanco Clásico Toro 750 Cmq;Bebidas-con-alcohol;837,84
Cerveza Lager STELLA ARTOIS   Botella 1 L;Bebidas-con-alcohol;1.117,35
Cerveza Bohemian Patagonia 1l;Bebidas-con-alcohol;1.125,91
Cerveza Wolf Ipa Temple 1l;Bebidas-con-alcohol;1.125,91
Cerveza Amber Lager Patagonia 1l;Bebidas-con-alcohol;1.125,91
Espumante Italian Pomela Frizze Bot 1 Ltr;Bebidas-con-alcohol;1.129,09
Espumante Evolution Blue Frizze Bot 1 Ltr;Bebidas-con-alcohol;1.129,09
Espumante Italian Limona Frizze Bot 1 Ltr;Bebidas-con-alcohol;1.129,09
Moscato EL ABUELO Bot 750cc;Bebidas-con-alcohol;847,56
Cerveza Cautiva Roja SALTA 473 Cmq;Bebidas-con-alcohol;534,83
Cerveza  Andes  Lata 473 CC;Bebidas-con-alcohol;540,77
Cerveza  Andes  Pack Latas 473 CC 6 Unidades;Bebidas-con-alcohol;3.244,68
Cerveza  MILLER   Lata 473 Cc;Bebidas-con-alcohol;542,56
Cerveza Lager STELLA ARTOIS   Botella 975 Cc;Bebidas-con-alcohol;1.119,20
Vino Blanco Pico De Oro 1125ml;Bebidas-con-alcohol;1.394,71
Cerveza  GROLSCH   Botella 925 Cc;Bebidas-con-alcohol;1.081,38
Cerveza Ipa Quilmes 1l;Bebidas-con-alcohol;1.179,28
Cerveza Golden Imperial Lat 710 Cmq;Bebidas-con-alcohol;841,23
Cerveza Lager Imperial  Lata 710 CC;Bebidas-con-alcohol;844,53
Cerveza Dorada Brahma 1l;Bebidas-con-alcohol;1.202,86
Espumante Italian Limon Frizze Lat 473 Ml;Bebidas-con-alcohol;569,05
Cerveza Ipa Roja ANDES Origen 473 Ml;Bebidas-con-alcohol;569,09
Cerveza Red Andes  Lata 473 CC;Bebidas-con-alcohol;569,09
Cerveza Red ANDES   Pack Latas 473 Cc 6 Unidades;Bebidas-con-alcohol;3.414,58
Cerveza Ipa ANDES   Pack Latas 473 Cc 6 Unidades;Bebidas-con-alcohol;3.414,58
Vino Blanco Viñas Y Parrales 1l;Bebidas-con-alcohol;1.311,62
Cerveza Golden Lager Imperial  Lata 473 CC;Bebidas-con-alcohol;579,46
Americano Mojito Dr.Lemon 473 Ml;Bebidas-con-alcohol;583,76
Americano Dr. Lemon Con Limón Lata 473 CC;Bebidas-con-alcohol;583,76
Americano Halloween Cherry Dr.Lemon 473 Ml;Bebidas-con-alcohol;583,76
Americano Dr. Lemon Con Vodka Lata 473 CC;Bebidas-con-alcohol;583,76
Aperitivo Vodka Pomelo Dr.Lemon Lat 473 Ml;Bebidas-con-alcohol;583,76
Americano Gintonic Dr.Lemon 473 Ml;Bebidas-con-alcohol;583,76
Vino Blanco Dulce Viñas Y Parrales 1l;Bebidas-con-alcohol;1.342,09
Cerveza  Miller  Lata 710 CC;Bebidas-con-alcohol;885,77
Espumante Italian Pomelo Frizze Lat 473 Ml;Bebidas-con-alcohol;597,51
Espumante Blue Evolution Frizze Lat 473 Ml;Bebidas-con-alcohol;597,51
Vino Tinto Pico De Oro 1125ml;Bebidas-con-alcohol;1.548,01
Vino Blanco Dulce Tardío Viñas Parrales 750 Ml;Bebidas-con-alcohol;1.033,70
Marsala . El Abuelo Bot 750 Cmq;Bebidas-con-alcohol;969,51
Cerveza Ipa Imperial  Lata 473 CC;Bebidas-con-alcohol;618,18
Cerveza Imperial Cream Stout Lat 473 Ml;Bebidas-con-alcohol;619,88
Cerveza Roja Imperial 473 Ml;Bebidas-con-alcohol;619,88
Cerveza Negra Salta 473 Cmq;Bebidas-con-alcohol;621,59
Americano Gancia  Lata 473 CC;Bebidas-con-alcohol;622,85
Vino Tinto Resero 700ml;Bebidas-con-alcohol;935,64
Aperitivo Vodka Con Limón Mikes X4 Uni 355 Cmq;Bebidas-con-alcohol;1.915,47
Vino Tinto Clasico TORO VIEJO 1125ml;Bebidas-con-alcohol;1.524,13
Jerez . EL ABUELO Bot 750 Cmq;Bebidas-con-alcohol;1.017,99
Oporto . El Abuelo Bot 750 Cmq;Bebidas-con-alcohol;1.019,60
Vino Tinto Clásico Toro 700ml;Bebidas-con-alcohol;953,79
Cerveza Fresquita ANDES Origen X4 Uni 2838 Ml;Bebidas-con-alcohol;2.580,21
Vino Blend Chenin-Torront Canciller Cja 3000 Ml;Bebidas-con-alcohol;4.093,92
Cerveza Ipa Quilmes 473ml;Bebidas-con-alcohol;647,10
Cerveza Ipa X6 Uni Quilmes Pak 2838 Ml;Bebidas-con-alcohol;3.882,72
Cerveza Ipa Grolsch 473ml;Bebidas-con-alcohol;660,74
Cerveza Lager GROLSCH   Lata 473 Cc;Bebidas-con-alcohol;661,47
Cerveza Lager STELLA ARTOIS   Lata 473 Cc;Bebidas-con-alcohol;673,08
Cerveza  Stella Artois  Pack Latas 473 CC 6 Unidades;Bebidas-con-alcohol;4.038,48
Vermouth CINZANO Bianco Botella 1 L;Bebidas-con-alcohol;1.435,27
Coctel De Pomelo Mingo 750 Ml;Bebidas-con-alcohol;1.100,11
Coctel De Limón Mingo 750 Ml;Bebidas-con-alcohol;1.100,11
Vino Moscato . Promesa Bot 750 Ml;Bebidas-con-alcohol;1.101,83
Cerveza  MILLER   Botella 330 Cc;Bebidas-con-alcohol;485,88
Cerveza Weisse PATAGONIA   Botella 730 Cc;Bebidas-con-alcohol;1.080,68
Cerveza Amber Lager PATAGONIA   Botella 730 Cc;Bebidas-con-alcohol;1.080,68
Cerveza Bohemian Pilsener PATAGONIA   Botella 730 Cc;Bebidas-con-alcohol;1.080,68
Cerveza Vera Ipa Patagonia Bot 730 Cmq;Bebidas-con-alcohol;1.080,68
Cerveza Session Ipa PATAGONIA   Botella 730 Cc;Bebidas-con-alcohol;1.080,68
Vino Fino Blanco Sweet White Desigual 750 Ml;Bebidas-con-alcohol;1.117,96
Vino Tinto Blend Iii Edición Especial Canciller 1000ml;Bebidas-con-alcohol;1.496,70
Aperitivo Spritz Hibiscus Gancia 473 Ml;Bebidas-con-alcohol;712,72
Cerveza Eazy 27 Lat 473 Ml;Bebidas-con-alcohol;712,78
Cerveza 27 Eazy 473 Ml Pak X6 Uni;Bebidas-con-alcohol;4.276,74
Vino Malbec Don Valentin Cja 3 Ltr;Bebidas-con-alcohol;4.545,20
Coctel Mango Con Alco Meet Lat 310 Ml;Bebidas-con-alcohol;473,75
Coctel Lima Con Alcoh Meet Lat 310 Ml;Bebidas-con-alcohol;473,75
Cerveza Pilsener BUDWEISER   Lata 473 Cc;Bebidas-con-alcohol;727,07
Cerveza  BUDWEISER   Pack Latas 473 Cc 6 Unidades;Bebidas-con-alcohol;4.364,08
HIRAM WALKER Vodka Botella De 1 Litro;Bebidas-con-alcohol;1.548,33
Vino Cabernet Malbec Estancia Mendoza Cja 3 Ltr;Bebidas-con-alcohol;4.659,07
Coctel De Limón Mingo Lat 355 Ml;Bebidas-con-alcohol;553,47
Coctel De Pomelo Mingo Lat 355 Ml;Bebidas-con-alcohol;553,47
Coctel De Maracuyá Mingo Lat 355 Ml;Bebidas-con-alcohol;553,47
Vino Syrah/Bonarda TORO VIEJO 1125 Ml;Bebidas-con-alcohol;1.781,45
Vino Reserva Malbec Viñas Parrales 750 Ml;Bebidas-con-alcohol;1.287,42
Cerveza Bapa Bieckert 473 Ml;Bebidas-con-alcohol;752,23
Cerveza Edición Hinchada Quilmes X 6u. 473ml;Bebidas-con-alcohol;4.554,99
Vino Chardonnay Chenin ESTANCIA MENDOZA 750 Ml;Bebidas-con-alcohol;1.213,06
Cerveza Scottish Lager TEMPLE   Pack Latas 473 Cc 6 Unidades;Bebidas-con-alcohol;4.592,69
Cerveza Ipa TEMPLE   Pack Latas 473 Cc 6 Unidades;Bebidas-con-alcohol;4.592,69
Cerveza Cósmica X6 Temple Pak 473cmq;Bebidas-con-alcohol;4.592,69
Cerveza Ipa TEMPLE   Lata 473 Cc;Bebidas-con-alcohol;765,47
Cerveza Scottish Lager TEMPLE   Lata 473 Cc;Bebidas-con-alcohol;765,47
Cerveza Indie Golden X Temple Pack 473cmq;Bebidas-con-alcohol;4.594,32
Cerveza Indie Golden Temple 473ml;Bebidas-con-alcohol;765,72
Licor Caña . 1° De Agost Bot 1 Ltr;Bebidas-con-alcohol;1.752,33
Vino Rosado Amenni Bot 750 Ml;Bebidas-con-alcohol;1.219,32
Vino Blanco Amenni Bot 750 Ml;Bebidas-con-alcohol;1.219,32
Gin Tonic Shooter 355ml;Bebidas-con-alcohol;625,41
Cerveza  CORONA   Botella 710 Cc;Bebidas-con-alcohol;1.159,41
Vino Fino Blanco Viñas De Alvear 750 Ml;Bebidas-con-alcohol;1.233,50
Vino Tinto Viñas De Alvear 750ml;Bebidas-con-alcohol;1.233,50
Cerveza Urbana Pilsen Bieckert 473 Ml;Bebidas-con-alcohol;789,85
Cerveza Budweiser Pack X4 Uni 710cmq;Bebidas-con-alcohol;4.776,26
Cerveza Budweiser 710ml;Bebidas-con-alcohol;1.194,07
Cerveza Doble Malta X6 Quilmes Pak 2838ml;Bebidas-con-alcohol;4.782,74
Cerveza Doble Malta Quilmes 473ml;Bebidas-con-alcohol;797,14
Whisky Añejo Doble V 1000 Ml;Bebidas-con-alcohol;1.691,04
Cerveza Brahma X6 U. 473ml;Bebidas-con-alcohol;4.803,45
Vino Tinto Edición Especi Resero Bot 1.125 Ltr;Bebidas-con-alcohol;1.919,03
Vino Bonarda Syrah Toro Viejo Bot 750 Cmq;Bebidas-con-alcohol;1.295,18
Cerveza Kolsch ANTARES   Lata 473 Cc;Bebidas-con-alcohol;822,53
Cerveza Scotch ANTARES   Lata 473 Cc;Bebidas-con-alcohol;822,53
Vino Tinto Clásico Toro Bot 1125 Ltr;Bebidas-con-alcohol;1.959,03
Aperitivo Ice Red Berries (Sabor Arandano Frambuesa) SMIRNOFF 473 Ml;Bebidas-con-alcohol;891,15
Vino Malbec OMNIUM Bot 750 CC;Bebidas-con-alcohol;1.311,90
Cerveza Brahma 473ml;Bebidas-con-alcohol;829,07
COLON Cabernet Sauvignon Botella De 750 Ml;Bebidas-con-alcohol;1.321,37
COLON Malbec Botella De 750 Ml;Bebidas-con-alcohol;1.321,37
Cerveza Extra Lager Edición Uar Imperial 473ml;Bebidas-con-alcohol;833,65
Vino Cabernet Clásico San Huberto Bot 1500 Ml;Bebidas-con-alcohol;2.859,84
Vino Malbec Clásico San Huberto Bot 1500 Ml;Bebidas-con-alcohol;2.859,84
Vino Fino Blanco Viñas De Alvear 1125ml;Bebidas-con-alcohol;1.986,56
Vino Tinto Viñas De Alvear 1125ml;Bebidas-con-alcohol;1.986,56
Vino Rosado Dulce Natural San Huberto Bot 750 Ml;Bebidas-con-alcohol;1.443,31
Vino F. Blanco Dulce Natural San Huberto Bot 750 Ml;Bebidas-con-alcohol;1.443,31
Vino Blend Vii Canciller Bot 1125 Ltr;Bebidas-con-alcohol;2.005,40
Cerveza Sin Alcohol Heineken 355cmq;Bebidas-con-alcohol;634,58
Licor Seco Tres Plumas 930 CC;Bebidas-con-alcohol;1.801,73
Jugo De Uva Natural Dogliani Bot 500 Ml;Bebidas-con-alcohol;898,99
Cerveza Sin Alcohol Stella Artois Lat 473cmq;Bebidas-con-alcohol;850,56
Mariposa Licor De Miel Botella De 750 Ml;Bebidas-con-alcohol;1.457,71
Cerveza Porter ANTARES   Porron 500 Cc;Bebidas-con-alcohol;905,02
Vino Tinto Clásico Toro Bot 750 Ml;Bebidas-con-alcohol;1.358,92
Vino White Blend Federico De Alvear 750 Ml;Bebidas-con-alcohol;1.358,96
Vino Fino Blanco Dulce Federico De Alvear 750 Ml;Bebidas-con-alcohol;1.358,96
Vino Red Blend Federico De Alvear 750 Ml;Bebidas-con-alcohol;1.358,96
Vino Rosé Dulce Federico De Alvear 750 Ml;Bebidas-con-alcohol;1.358,96
Cerveza Playa Grande Antares 473ml;Bebidas-con-alcohol;860,00
CUSENIER Licor De Melón Botella De 700 Ml;Bebidas-con-alcohol;1.274,34
Vino Tinto Blend Merlot Syrah Malbec Canciller Cja 3 Ltr;Bebidas-con-alcohol;5.509,72
Cerveza Lager Amstel 710ml;Bebidas-con-alcohol;1.308,55
Vino Blanco Blend CANCILLER 750ml;Bebidas-con-alcohol;1.387,89
Vino Malbec Day DILEMA 3 L;Bebidas-con-alcohol;5.552,60
Cerveza Dorada PAMPA BREWING CO   Lata 473 Cc;Bebidas-con-alcohol;950,40
Cerveza Amber Ale PAMPA BREWING CO   Lata 473 Cc;Bebidas-con-alcohol;950,40
Cerveza Artesanal Honey Ale Pampa Brewing Co Lat 473 Cmq;Bebidas-con-alcohol;950,40
Cerveza Nitro Cream Stout Pampa Brewing Co Bot 473 Cmq;Bebidas-con-alcohol;950,40
Vino Rosado Rosé Cafayate Bot 750 Ml;Bebidas-con-alcohol;1.399,82
Vino Pinot Grigio Frida 750ml;Bebidas-con-alcohol;1.407,76
Vino Selección Tinto Lacrado Toro Bot 1.125 Ltr;Bebidas-con-alcohol;2.119,06
Cerveza Lager LIT Light Lata 473 Cc;Bebidas-con-alcohol;962,31
Cerveza Irish Red Ale Lit Lat 473 Cmq;Bebidas-con-alcohol;962,31
Aperitivo Ice Original (Sabor Original) SMIRNOFF 473 Ml;Bebidas-con-alcohol;891,15
Vino Malbec NOVECENTO Bot 750 CC;Bebidas-con-alcohol;1.529,14
Vino Cabernet Sauvignon NOVECENTO Bot 750 CC;Bebidas-con-alcohol;1.529,14
NOVECENTO Blend De Blancas 750c;Bebidas-con-alcohol;1.529,14
Sidra Original Del Valle Lat 473 Cmq;Bebidas-con-alcohol;895,00
Sidra Fresa Del Valle 473ml;Bebidas-con-alcohol;895,00
Sidra Anana Del Valle 473ml;Bebidas-con-alcohol;895,00
Cerveza Heineken Edición 150 Años 1l;Bebidas-con-alcohol;1.940,78
Vino Blend Bonarda/Syrah/ CANCILLER Bot 750 Ml;Bebidas-con-alcohol;1.457,27
Vino Tinto Blend, Red Win Canciller Bot 750 Ml;Bebidas-con-alcohol;1.457,27
Cerveza Afa Schneider 473ml;Bebidas-con-alcohol;924,17
Cerveza Ipa Antares  Lata 473 CC;Bebidas-con-alcohol;924,72
Cerveza Honey ANTARES   Lata 473 Cc;Bebidas-con-alcohol;924,72
Cerveza Ipa Antares  Lata 473 CC;Bebidas-con-alcohol;924,72
Vermouth MARTINI Rosso Botella 995 Cc;Bebidas-con-alcohol;1.953,67
Vermouth MARTINI Bianco Botella 995 Cc;Bebidas-con-alcohol;1.967,87
Vino Chardonnay ELEGIDO Bot 750 Ml;Bebidas-con-alcohol;1.488,28
Vino Malbec ELEGIDO Bot 750 Ml;Bebidas-con-alcohol;1.488,28
Vino Cabernet Sauvignon ELEGIDO Bot 750 Ml;Bebidas-con-alcohol;1.488,28
Vino Fino Tinto Cría De Cosechas 1,25l;Bebidas-con-alcohol;2.444,90
Vino Malbec/Syrah TORO Bot 1,125 Ltr;Bebidas-con-alcohol;2.265,76
Cerveza Sin Alcohol Stella Artois 2838cmq;Bebidas-con-alcohol;5.717,13
Vino Malbec Mandala 750cc;Bebidas-con-alcohol;1.512,26
Vino Sweet Mandala 750cc;Bebidas-con-alcohol;1.512,26
Vino Rosé MANDALA 750cc;Bebidas-con-alcohol;1.512,26
Cerveza  CORONA   Porron 330 Cc;Bebidas-con-alcohol;666,83
Cerveza Session Ipa Kunstmann Lat 470 Cmq;Bebidas-con-alcohol;953,66
Vino Chenin Dulce Cantus 750ml;Bebidas-con-alcohol;1.522,82
Vino Malbec Cantus 750ml;Bebidas-con-alcohol;1.522,82
Cerveza Torobayo Kunstmann Lat 470 Cmq;Bebidas-con-alcohol;957,98
Vino Malbec CANCILLER Bot 750 CC;Bebidas-con-alcohol;1.530,96
Vino Malbec Cabernet Estancia Mendoza 750ml;Bebidas-con-alcohol;1.531,36
Sidra Et.Blanca LA FARRUCA Bot 710 CC;Bebidas-con-alcohol;1.450,00
Vino Tinto Blend Magnum Viñas Parrales 1125ml;Bebidas-con-alcohol;2.509,44
Vino Tinto Blend Magnum Marques Del Sur 1125 Ml;Bebidas-con-alcohol;2.509,44
Vino Malbec Los Primos Cja 3 Ltr;Bebidas-con-alcohol;6.217,51
Vino VALMONT Tinto   750 CC;Bebidas-con-alcohol;1.562,85
Vino Malbec - San Telmo Bot 750 Cmq;Bebidas-con-alcohol;1.563,82
Vino Cab.Sauv - San Telmo Bot 750 Cmq;Bebidas-con-alcohol;1.563,82
Cerveza Ipa PAMPA BREWING CO   Lata 473 Cc;Bebidas-con-alcohol;1.069,20
Espumante Blanco Demi Sec Federico De Alvear Bot 750 Ml;Bebidas-con-alcohol;1.573,55
Vino Tinto Patero Cría De Cosechas 1,25l;Bebidas-con-alcohol;2.550,32
Vino Malbec-Bonarda Cría De Cosechas 700cc;Bebidas-con-alcohol;2.550,32
Vino F.Rosad Dulce Finca Las M Bot 750 Ml;Bebidas-con-alcohol;1.575,84
Vino Cab.Sauv . CANCILLER Bot 1125 Ml;Bebidas-con-alcohol;2.364,99
Vino Sauvign Blanc Finca Las M Bot 750 Cmq;Bebidas-con-alcohol;1.579,42
Vino Merlot . Trapiche Bot 750 Cmq;Bebidas-con-alcohol;1.584,27
Vino Syrah Alaris TRAPICHE Bot 750 CC;Bebidas-con-alcohol;1.584,27
Sidra Etiqueta Blanc DEL VALLE Bot 710 Cmq;Bebidas-con-alcohol;1.500,00
Vino Chardonnay Fran X750 Ml;Bebidas-con-alcohol;1.711,89
Vino Blend Fran X750 Ml;Bebidas-con-alcohol;1.711,89
Cerveza Sin Alcohol Roja Imperial 355ml;Bebidas-con-alcohol;750,40
Cerveza Sin Alcohol Golden Imperial 355ml;Bebidas-con-alcohol;750,40
Vino Syrah Gran Nacha Tin Liga De Los Bot 750 Ml;Bebidas-con-alcohol;1.589,91
Cerveza Noire X6 Uni Stella Artois 2460 Ml;Bebidas-con-alcohol;5.216,04
Cerveza Belgium Stella Artois 410ml;Bebidas-con-alcohol;869,34
Cerveza Belgium X6 Uni Stella Artois 2460 Ml;Bebidas-con-alcohol;5.216,04
Vino Sauvign Blanc Altas Cumbr Bot 750 Cmq;Bebidas-con-alcohol;1.718,27
Vino Rosado Dulce Dilema  Bot 750 Ml;Bebidas-con-alcohol;1.591,96
Vino EUGENIO BUSTOS Malbec 750cc;Bebidas-con-alcohol;1.597,38
Gintonic Gordons 473 Ml;Bebidas-con-alcohol;1.007,61
Vino F. Blanco Dulce Eugenio Bus Bot 750 Ml;Bebidas-con-alcohol;1.599,32
Cerveza Golden Imperial 473ml;Bebidas-con-alcohol;1.009,26
Aperitivo Coctel Mojito Bacardi Lat 310 Ml;Bebidas-con-alcohol;662,27
Aperitivo Coctel Rum & C Bacardi Lat 310 Ml;Bebidas-con-alcohol;662,27
Licor Livian Amareto Tres Plum Bot 700 Cmq;Bebidas-con-alcohol;1.616,11
Licor Exotic Blue Curacao TRES PLUMAS 700cmq;Bebidas-con-alcohol;1.616,11
Licor Livian Melon Tres Plum Bot 700 Cmq;Bebidas-con-alcohol;1.616,11
CUSENIER Licor De Menta Botella De 700 Ml;Bebidas-con-alcohol;1.508,84
CUSENIER Licor De Blue Curacao Botella De 700 Ml;Bebidas-con-alcohol;1.508,84
CUSENIER Licor De Frutillas Botella De 700 Ml;Bebidas-con-alcohol;1.508,84
Cerveza Superior Suave Michelob 473ml;Bebidas-con-alcohol;1.031,48
Cerveza Superior Suave Michelob 2838ml;Bebidas-con-alcohol;6.188,89
Vino Tinto Dulce NORTON Cosecha Tardía 750ml;Bebidas-con-alcohol;1.641,66
8 HERMANOS Azul Anis Botella De 1 Litro;Bebidas-con-alcohol;2.370,54
Vino Tinto Clásico Blend Goyenechea 750ml;Bebidas-con-alcohol;1.778,11
Vino Blanco Traful 750c;Bebidas-con-alcohol;1.778,11
Cerveza Sin Alcohol 0.0 HEINEKEN 330c;Bebidas-con-alcohol;729,02
Cerveza Genuine Draft Miller 473ml;Bebidas-con-alcohol;1.045,19
Cerveza Corona X6 U. 2460 Ml;Bebidas-con-alcohol;5.454,72
Cerveza Corona 410ml;Bebidas-con-alcohol;909,12
Sidra Pear Artesanal Pyrus 473 Ml;Bebidas-con-alcohol;1.048,95
Sidra Cider Artesana Pyrus 473 Ml;Bebidas-con-alcohol;1.048,95
Cerveza Munich Helles Rabieta Lat 473 Cmq;Bebidas-con-alcohol;1.134,00
Cerveza Red RABIETA   Lata 473 Cc;Bebidas-con-alcohol;1.134,00
Cerveza Red Honey RABIETA   Lata 473 Cc;Bebidas-con-alcohol;1.134,00
Cerveza Golden Ale RABIETA   Lata 473 Cc;Bebidas-con-alcohol;1.134,00
Cerveza Blonde Ale Siete Chola Lat 473 Cmq;Bebidas-con-alcohol;1.134,00
Vino Reserva Cabernet San Huberto Bot 750 Ml;Bebidas-con-alcohol;1.803,69
Vino Cab.Sauv . DILEMA DAY Bot 750 Ml;Bebidas-con-alcohol;1.671,56
Vino Malbec . DILEMA DAY Bot 750 Ml;Bebidas-con-alcohol;1.671,56
Vino Rosado . DILEMA DAY Bot 750 Ml;Bebidas-con-alcohol;1.671,56
Vino Tinto Dulce Velvet Dilema 750 Ml;Bebidas-con-alcohol;1.671,57
Vino Cabernet Sauvignon Etnia 750cmq;Bebidas-con-alcohol;1.809,86
Vino Malbec Etnia 750cmq;Bebidas-con-alcohol;1.809,86
Vino Cabernet Sauvignon Fair For Life Finca Las Moras 750 Ml;Bebidas-con-alcohol;1.677,25
Vino F.Blanc Brut Goyeneche Bot 750 Cmq;Bebidas-con-alcohol;1.822,56
Vino Cab.Sau . Goyeneche Bot 750 Cmq;Bebidas-con-alcohol;1.822,56
Vino Syrah GOYENECHEA Bot 750 CC;Bebidas-con-alcohol;1.822,56
Vino Cabernet Sauvignon SADE Bot 750 Ml;Bebidas-con-alcohol;1.825,10
Vino Blanco Dulce Natural Sade 750 Ml;Bebidas-con-alcohol;1.825,10
Vino Malbec SADE Bot 750 Ml;Bebidas-con-alcohol;1.825,10
Vino Chardonnay . Estancia Me Bot 750 Cmq;Bebidas-con-alcohol;1.691,42
Vino Chardonnay CANCILLER 750cmq;Bebidas-con-alcohol;1.696,63
Cerveza Warsteiner 1l;Bebidas-con-alcohol;2.268,42
Vino F.Tinto Malbec LA COLONIA Bot 750 Cmq;Bebidas-con-alcohol;1.704,65
Vino F.Tinto Cabernet Sauvi LA COLONIA Bot 750 Cmq;Bebidas-con-alcohol;1.704,65
Vino Dulce Natural . Finca Las M Bot 750 Ml;Bebidas-con-alcohol;1.707,67
Vino Rosado Mil Rosas 750 Ml;Bebidas-con-alcohol;1.708,07
Vino Cabernet Sirah Clásico San Huberto 750ml;Bebidas-con-alcohol;1.846,96
Vino Bonarda Syrah Clásico San Huberto 750ml;Bebidas-con-alcohol;1.846,96
Vino Cabernet Malbec Clásico San Huberto 750ml;Bebidas-con-alcohol;1.846,96
Cerveza Edición 150 Años Heineken 473ml;Bebidas-con-alcohol;1.080,66
Cerveza Rubia Andes Origen 710ml;Bebidas-con-alcohol;1.624,59
Vino Sau Blanc . GOYENECHEA Bot 750 Ml;Bebidas-con-alcohol;1.856,85
Vino Chardon . Goyenechea Bot 750 Cmq;Bebidas-con-alcohol;1.856,85
Vino Malbec GOYENECHEA Bot 750 CC;Bebidas-con-alcohol;1.856,85
Vino Cab.Sauv Roble TERRA Bot 750 Cmq;Bebidas-con-alcohol;1.724,56
Vino Malbec TERRA Bot 750 CC;Bebidas-con-alcohol;1.724,56
Vermouth CARPANO Bianco Botella 950 Cc;Bebidas-con-alcohol;2.360,11
Americano GANCIA Botella 950 Cc;Bebidas-con-alcohol;2.187,55
Gin &Tonic Faisan 354 Ml;Bebidas-con-alcohol;880,43
Vodka . ORLOFF Bot 750 Ml;Bebidas-con-alcohol;1.731,89
Vino Rosado Dulce UGARTECHE Bot 750 Ml;Bebidas-con-alcohol;1.873,26
Vino Malbec . UGARTECHE Bot 750 Ml;Bebidas-con-alcohol;1.873,26
Vino Seleccion Del Enologo UGARTECHE Bot 750 Ml;Bebidas-con-alcohol;1.873,26
Vino F. Blanco Dulce UGARTECHE Bot 750 Ml;Bebidas-con-alcohol;1.873,26
Vino Cab.Sauv . UGARTECHE Bot 750 Ml;Bebidas-con-alcohol;1.873,26
Vino Merlot Cabernet Selec Colon Bot 750 Ml;Bebidas-con-alcohol;1.737,60
Vino Malbec Selecto Colon Bot 750 Ml;Bebidas-con-alcohol;1.737,60
Vino Syrah Selecto Colon Bot 750 Ml;Bebidas-con-alcohol;1.737,60
Vino Cab.Sauv Selecto Colon Bot 750 Ml;Bebidas-con-alcohol;1.737,60
Vino Chenin Sauvignon Blan Colon Bot 750 Ml;Bebidas-con-alcohol;1.738,34
Vino Rose Selecto Colon Bot 750 Ml;Bebidas-con-alcohol;1.738,34
Vino Chardonnay Selecto Colon 750 Ml;Bebidas-con-alcohol;1.738,34
Sidra Et. Negra LA FARRUCA Bot 710 Cmq;Bebidas-con-alcohol;1.650,00
Vino Cabernet Franc Septima 750 Ml;Bebidas-con-alcohol;1.893,79
Vino Dulce Natural . TRAPICHE Bot 750 Cmq;Bebidas-con-alcohol;1.755,30
CUSENIER Licor De Limoncello Botella De 700 Ml;Bebidas-con-alcohol;1.639,98
CUSENIER Licor De Chocolate Botella De 700 Ml;Bebidas-con-alcohol;1.639,98
Whisky Hiram Walker 750ml;Bebidas-con-alcohol;1.757,45
Vino Rosado De Bonarda Finca Magnolia 750 Ml;Bebidas-con-alcohol;1.759,17
Vino Cabernet . Pirueta Bot 750 Ml;Bebidas-con-alcohol;1.760,01
Vino Malbec . Pirueta Bot 750 Ml;Bebidas-con-alcohol;1.760,01
Vino Malbec Finca Magnolia Los Helecho Cja 3 Ltr;Bebidas-con-alcohol;7.049,07
Sidra Et.Blanca REINA DE ALCANTARA Bot 720 Cmq;Bebidas-con-alcohol;1.700,00
Cerveza Oktoberfest PEÑON DEL AGUILA   Lata 473 Cc;Bebidas-con-alcohol;1.211,10
Cerveza Kolsch PEÑON DEL AGUILA   Lata 473 Cc;Bebidas-con-alcohol;1.211,10
Cerveza Lata Schwarzeier Peñon Del Aguila Lat 473 Ml;Bebidas-con-alcohol;1.211,10
Cerveza Honigbier  PEÑON DEL AGUILA   Lata 473 Cc;Bebidas-con-alcohol;1.211,10
Cerveza Hefeweizen PEÑON DEL AGUILA   Lata 473 Cc;Bebidas-con-alcohol;1.211,10
Cerveza Mexican Lager PEÑON DEL AGUILA   Lata 473 Cc;Bebidas-con-alcohol;1.211,10
Vino Cab/Syrah . DRALION Bot 750 Ml;Bebidas-con-alcohol;1.779,88
Vino Malbec/Syrah . DRALION Bot 750 Ml;Bebidas-con-alcohol;1.779,88
Vino Tinto Patero Resero 1125ml;Bebidas-con-alcohol;2.672,01
Vino CALLIA Tardío Tinto 750ml;Bebidas-con-alcohol;1.782,00
Vino CALLIA Tardío Blanco 750ml;Bebidas-con-alcohol;1.782,00
Vino CALLIA Tardío Rosado 750ml;Bebidas-con-alcohol;1.782,00
Vino Red Blend Los Pasos 750 Ml;Bebidas-con-alcohol;1.931,19
Vino Chardonnay Semillón Los Pasos 750 Ml;Bebidas-con-alcohol;1.931,19
Vino Malbec Los Pasos 750 Ml;Bebidas-con-alcohol;1.931,19
Vino Cabernet Sauvignon Los Pasos 750 Ml;Bebidas-con-alcohol;1.931,19
Vino Malbec Clásico San Huberto 750ml;Bebidas-con-alcohol;1.939,31
Vino Cabernet Sauvignon Clásico San Huberto 750ml;Bebidas-con-alcohol;1.939,31
Vino Rosado ALARIS Rosé Dulce Cosecha 750 CC;Bebidas-con-alcohol;1.800,15
Vino Blend Mendoza Vendimiario Bot 750 Ml;Bebidas-con-alcohol;1.806,84
Vino Blend Origen San Jua Vendimiario Bot 750 Ml;Bebidas-con-alcohol;1.806,84
Vino Blend Origen La Rioj Vendimiario Bot 750 Ml;Bebidas-con-alcohol;1.806,84
Vino Blanco Salta VENDIMIARIO Bot 750 Ml;Bebidas-con-alcohol;1.806,84
Vino Fino Blanco Clásico Finca Natalina 750ml;Bebidas-con-alcohol;1.811,56
Vino Tinto Clásico Finca Natalina 750ml;Bebidas-con-alcohol;1.811,56
Vino Rosé De Syrah Callia 750ml;Bebidas-con-alcohol;1.812,22
Cerveza Apa RABIETA   Lata 473 Cc;Bebidas-con-alcohol;1.252,80
Cerveza Red Ipa RABIETA   Lata 473 Cc;Bebidas-con-alcohol;1.252,80
Cerveza Ipa RABIETA   Lata 473 Cc;Bebidas-con-alcohol;1.252,80
Cerveza Ipa Siete Chola Lat 473 Cmq;Bebidas-con-alcohol;1.252,80
Cerveza  RABIETA  Wee Heavy Lata 473 Cc;Bebidas-con-alcohol;1.252,80
Cerveza Extra Stout Guinness Lat 473 Ml;Bebidas-con-alcohol;1.252,80
Cerveza 150 Años Heineken 710ml;Bebidas-con-alcohol;1.749,64
Vino Malbec Alaris TRAPICHE Bot 750 CC;Bebidas-con-alcohol;1.854,71
Vino Malbec FINCA LAS MORAS Bot 750 CC;Bebidas-con-alcohol;1.854,71
Vino Cabernet Sauvignon Alaris TRAPICHE Bot 750 CC;Bebidas-con-alcohol;1.854,71
Vino Malbec SAN FELIPE S/Madera Bot 750 CC;Bebidas-con-alcohol;1.859,39
Vino Fino Blanco Dulce Marló 269 Ml;Bebidas-con-alcohol;669,28
Vino Malbec Septima Box 3 Ltr;Bebidas-con-alcohol;8.083,95
Sidra Et.Blanca Victoria Bot 720 Cmq;Bebidas-con-alcohol;1.800,00
Vino Pinot Grigio Orgánico ARGENTO Estate Bottled;Bebidas-con-alcohol;1.880,06
Licor Livian Cafe Tres Plum Bot 750 Cmq;Bebidas-con-alcohol;2.033,36
Licor TRES PLUMAS Cafe Al Ron Bot 750 CC;Bebidas-con-alcohol;2.033,36
Licor Cafe Al Chocolate TRES PLUMAS Bot 750 Cmq;Bebidas-con-alcohol;2.033,36
Licor A/Whis Cafe Tres Plum Bot 750 Cmq;Bebidas-con-alcohol;2.033,36
Vino Cabernet Sauvignon Roble Etnia 750cmq;Bebidas-con-alcohol;2.038,48
Vino Malbec Roble Etnia 750ml;Bebidas-con-alcohol;2.038,48
Vino Blend Bt4 EL BAUTISMO Bot 750 Ml;Bebidas-con-alcohol;1.887,80
Sidra Cider Artesanal Pyrus Bot 500 Cmq;Bebidas-con-alcohol;1.260,00
Sidra Pear Artesanal Pyrus Bot 500 Cmq;Bebidas-con-alcohol;1.260,00
Sidra Gran Rosé Cosecha Privada 1950 750 Ml;Bebidas-con-alcohol;1.892,82
Sidra COSECHA PRIVADA 750 CC;Bebidas-con-alcohol;1.892,82
Vino Sauvignon Blanc Emilia X750 Ml;Bebidas-con-alcohol;2.044,40
Vino Chardonnay Emilia X750 Ml;Bebidas-con-alcohol;2.044,40
Vino Chardonnay . DILEMA DAY Bot 750 Ml;Bebidas-con-alcohol;1.894,92
Vermouth MARTINI Extra Dry Botella 995 Cc;Bebidas-con-alcohol;2.516,61
Vermouth CINZANO Rosso Botella 1 L;Bebidas-con-alcohol;2.529,27
Vodka Coctel Waterme ORLOFF 750 Ml;Bebidas-con-alcohol;1.897,10
Vodka Coctel Rasberr ORLOFF Bot 750 Ml;Bebidas-con-alcohol;1.897,26
Durazno Fizz . La Farruca Bot 710 Cmq;Bebidas-con-alcohol;1.800,00
Fresas Fizz . La Farruca Bot 710 Cmq;Bebidas-con-alcohol;1.800,00
Clerico Fizz . La Farruca Bot 710 Cmq;Bebidas-con-alcohol;1.800,00
Anana Fizz . La Farruca Bot 710 Cmq;Bebidas-con-alcohol;1.800,00
Vino Sau Blanc Barrel Select NORTON Bot 750 Ml;Bebidas-con-alcohol;1.907,32
Vino Rosado Dulce Simona Los Helecho 750 Ml;Bebidas-con-alcohol;1.908,32
Vino F. Blanco Dulce Simona Los Helecho Bot 750 Ml;Bebidas-con-alcohol;1.908,32
Vino Cabernet Sauvignon NOVECENTO Reserva Bot 750 CC;Bebidas-con-alcohol;2.072,92
Vino Chardonnay Raices NOVECENTO 750c;Bebidas-con-alcohol;2.072,92
Vino Malbec NOVECENTO Reserva Bot 750 CC;Bebidas-con-alcohol;2.072,92
Anana Fizz . DEL VALLE Bot 720 Cmq;Bebidas-con-alcohol;1.850,00
Vino Malbec . Picada 15 Bot 750 Cmq;Bebidas-con-alcohol;2.084,44
Vino Cabernet Sauvignon PICADA 15 Bot 750 CC;Bebidas-con-alcohol;2.084,44
Vino Blanco Dulce Tardio Marques Del Sur 750ml;Bebidas-con-alcohol;2.086,66
Vino Malbec San Huberto Centenario 750ml;Bebidas-con-alcohol;2.087,09
Vino Cabernet Sauvignon San Huberto Centenario 750ml;Bebidas-con-alcohol;2.087,09
Cerveza Waldbier PEÑON DEL AGUILA   Lata 473 Cc;Bebidas-con-alcohol;1.318,12
