Product;Category;Price
Té En Hebras Be Orange Inti Zen 60 Grm;Infusiones;3.210,26
Té En Hebras Matcha Detox Inti Zen 60 Grm;Infusiones;3.210,26
Té En Hebras Blue Earl Grey Inti Zen 60 Grm;Infusiones;3.210,26
Café Cápsulas Espresso CABRALES Cja 72 Grm;Infusiones;3.881,91
Cafe Capsula Costa CABRALES Cja 55 Grm;Infusiones;3.283,34
Café En Cápsulas STARBUCKS House Blend X 57gr;Infusiones;3.776,05
Café En Cápsulas STARBUCKS Espreso Roast X 57gr;Infusiones;3.776,05
STARBUCKS Nespresso Pike Place X 10u.;Infusiones;3.776,05
Choclo Amarillo Cremoso Inalpa Vida 300 Grm;Conservas;182,98
Porotos Inalpa Lat 300 Grm;Conservas;219,74
Choclo Amarillo Cremoso Inalpa Lat 300 Grm;Conservas;325,19
Choclo Blanco Cremoso La Banda 340 Grm;Conservas;374,67
Arvejas Secas Remojadas Doña Pupa 500 Grm;Conservas;579,16
Arvejas Secas Remojadas Doña Pupa 340 Grm;Conservas;408,96
Choclo Amarillo Cremoso La Banda 340 Grm;Conservas;410,24
Soja Inalpa 300 Grm;Conservas;367,79
Choclo Blanco Cremoso Inalpa 300 Grm;Conservas;381,98
Poroto Alubia Arcor Lat 300 Grm;Conservas;382,58
Arvejas Bajo En Sodio Doña Pupa 340 Grm;Conservas;435,64
Lentejas Secas Inalpa 300 Grm;Conservas;410,38
Choclo Cremoso Ciudad Del Lago 300 Gr;Conservas;484,09
Choclo Blanco Cremoso Doña Pupa 340 Grm;Conservas;477,55
Garbanzos Secos Inalpa 300 Grm;Conservas;424,59
Porotos Colorados Inalpa 300 Grm;Conservas;424,59
Porotos Negros Inalpa 300 Grm;Conservas;424,59
Arvejas Secas Remojadas Ciudad Del Lago 300 Grm;Conservas;436,62
Arvejas Ciudad Del Lago Lata 300 Gr;Conservas;436,62
Choclo Amarillo Cremoso Doña Pupa 340 Grm;Conservas;505,49
Arvejas Secas Remojadas Coto 300 Grm;Conservas;466,50
Pate De Foie La Blanca Lat 90 Grm;Conservas;149,96
Porotos Negros Doña Pupa 340 Grm;Conservas;577,89
Porotos Negros Inca 350g;Conservas;600,00
Choclo Blanco Cremoso En Granos Ciudad Del Lago 300 Grm;Conservas;516,90
Lentejas Secas Inalpa Vida 300 Grm;Conservas;523,99
Porotos Colorados Inca 350g;Conservas;612,00
Jardinera 4 Legumbres Ciudad Del Lat 300 Grm;Conservas;531,07
Durazno COPA DE ORO Light 820gr;Conservas;1.452,85
Porotos Colorados Doña Pupa 340 Grm;Conservas;604,56
Porotos Secos Remojados Ciudad Del Lago 300 Grm;Conservas;535,23
Atun En Aceite GOMES DA COSTA Desmenuzado Lata 170 Gr;Conservas;303,94
Garbanzos Secos Remojados Inca Lat 350 Grm;Conservas;632,00
Durazno Amarillos En Trozos Comunes ALCO 820 Gr;Conservas;1.512,71
Choclo Amarillo Cremoso En Granos Ciudad Del Lago 300 Grm;Conservas;556,70
Lentejas Secas Remojadas Ciudad Del Lago 300 Grm;Conservas;561,99
Peras En Mitades Light Copa De Oro 800 Grm;Conservas;1.512,72
Jardinera Doña Pupa 340 Grm;Conservas;646,47
Arveja COTO Remojadas Lata 340 Gr;Conservas;416,00
Choclo Crem/Bco INCA Lat 350 Grm;Conservas;695,00
Choclo Crem/Amar. INCA Lat .35 Kgm;Conservas;711,00
Jardinera Ciudad Del Lago 300 Grm;Conservas;628,98
Jardinera 3 Legumbres CIUDAD DEL LAGO  Lat 300 Grm;Conservas;628,98
Coctel 4 Frutas Copa De Oro 820 Grm;Conservas;1.728,03
Coctel 4 Frutas Light Copa De Oro 800 Grm;Conservas;1.711,63
Arveja Seca/Rem INCA Lat 350 Gr;Conservas;440,00
Lentejas Secas Remojadas Doña Pupa 340 Grm;Conservas;749,35
Garbanzos Secos Remojados Ciudad Del Lago 300 Grm;Conservas;670,58
Pulpa Frutilla Bahia Bot 820 Grm;Conservas;1.890,37
Pulpa Anana Bahia Bot 820 Grm;Conservas;1.890,90
Pulpa Durazno Bahia Bot 820 Grm;Conservas;1.890,90
Porotos Alubia La Banda 350 Grm;Conservas;463,58
Choclo Amarillo En Granos Inalpa 300 Grm;Conservas;708,60
Choclo Amarillo En Granos Inalpa Vida 300 Grm;Conservas;708,60
Arvejas Y Choclo Ciudad Del Lago 300 Grm;Conservas;717,78
Arveja Y Choclo . Ciudad Del Lat 300 Grm;Conservas;717,78
Durazno CIUDAD DEL LAGO Lata 820 Gr;Conservas;1.224,72
Atun Al Natural GOMES DA COSTA Desmenuzado Lata 170 Gr;Conservas;303,94
Durazno COTO Lata 820 Gr;Conservas;1.317,56
Peras COTO Lata 820 Gr;Conservas;1.249,69
Granos De Choclo Amarillo Enteros Ciudad Del Lago 300 Grm;Conservas;833,64
Picadillo De Carne Sabor Picante Swift Lat 90 Grm;Conservas;255,17
Pulpa Frutilla BAHIA   Lata 420 Gr;Conservas;1.195,08
Pulpa Anana BAHIA   Lata 420 Gr;Conservas;1.196,10
Pulpa Durazno Para Cócteles Bahia 420g;Conservas;1.196,10
Peras Coto Light Lata 800 Gr;Conservas;1.332,98
Durazno En Trozos Copa De Oro Lat 820 Grm;Conservas;1.464,76
Durazno En Mitades Copa De Oro Lat 820 Grm;Conservas;1.473,42
Poroto Secos Remojado INCA Lat 350 Grm;Conservas;614,00
Picadillo Carne SWIFT Lat 90 Gr;Conservas;274,86
Pate Foie SWIFT Lat 90 Gr;Conservas;274,86
Durazno Dietético En Mitades Alco 800g;Conservas;1.524,31
Jardinera INCA 350 Gr;Conservas;692,00
Choclo Entero Ciudad Del Lago 300 Gr;Conservas;952,73
Lentejas Secas Remojada INCA Lat 350 Grm;Conservas;670,00
Peras En Mitades Diet Alco Lat 800 Grm;Conservas;1.525,24
Porotos Manteca La Egipciana Bol 500 Grm;Conservas;1.829,68
Jamón Del Diablo Swift Lat 88 Grm;Conservas;325,35
Jardinera C/Choclo Inca Lat 350 Grm;Conservas;817,00
Lomo Natural Bajo En Sodio Gomes Da Costa Lat 170 Grm;Conservas;662,69
Paté De Foie Con Hongos Swift Est 85 Gr;Conservas;331,91
Pate De Foie Con Pimienta Verde Swift Est 85 Grm;Conservas;331,91
Anana CIUDAD DEL LAGO Lata 565 Gr;Conservas;1.487,47
Anana CIUDAD DEL LAGO Lata 850 Gr;Conservas;2.168,27
Anana CIUDAD DEL LAGO Lata 567 Gr;Conservas;1.518,16
Pate De Foie Swift A La Crema Lat 85 Grm;Conservas;381,73
Anana COTO Lata 850 Gr;Conservas;2.352,25
Macedonia COTO Legumbres Y Hortalizas Lata 400 Gr;Conservas;1.332,20
Mejillones En Aceite GOMES DA COSTA Lata 190 Gr;Conservas;1.001,24
Choritos Al Natural Gomes Da Costa Lat 190 Grm;Conservas;1.001,24
Champignon Enteros CIUDAD DEL LAGO Lata 400 Gr;Conservas;1.220,23
Caballa Natural Pennisi 380 Grm;Conservas;2.029,59
Caballa En Aceite Pennisi 380 Grm;Conservas;2.046,92
Anana COTO Lata 227 Gr;Conservas;1.304,25
Atun En Aceite CIUDAD DEL LAGO Desmenuzado Lata 170 Gr;Conservas;729,38
Atun Al Natural  CIUDAD DEL LAGO Desmenuzado Lata 170 Gr;Conservas;765,84
Choclo Grano INCA Lat 202 Grm;Conservas;1.323,00
Palmitos En Trozos CIUDAD DEL LAGO Lata 800 Gr;Conservas;3.321,58
Pimiento Morron Enteros CIUDAD DEL LAGO Lata 220 Gr;Conservas;999,44
Atun En Aceite GOMES DA COSTA Lata 110 Gr;Conservas;949,98
Champignones Enteros La Banda 400 Grm;Conservas;1.847,97
Palmitos En Trozos CIUDAD DEL LAGO Lata 400 Gr;Conservas;1.925,32
Frijoles Negros La Costeña 400 Grm;Conservas;1.794,15
Lomitos De Atún En Aceite Ciudad Del Lago 160g;Conservas;1.460,59
Lomitos De Atún Al Natural Ciudad Del Lago 160g;Conservas;1.460,59
Palmitos Enteros CIUDAD DEL LAGO Lata 800 Gr;Conservas;4.678,82
Lomo De Atún Al Natural La Campagnola 170 Grm;Conservas;1.690,41
Lomo De Atún En Aceite La Campagnola 170 Grm;Conservas;1.690,41
Sardina En Aceite Pennisi 160g;Conservas;1.593,51
Atun Claro Al Natural Coto Lat 185 Grm;Conservas;1.910,09
Atun Aleta Amarilla En Aceite COTO Lata 185 Gr;Conservas;1.485,93
Atun Aleta Amarilla Al Natural COTO Lata 185 Gr;Conservas;1.485,93
Atun Al Natural GOMES DA COSTA En Trozos Lata 170 Gr;Conservas;1.274,02
Conservas Hojas De Parra Kilikia Fra 660 Grm;Conservas;7.086,73
Arveja Fresca Bonduelle 300 Gr;Conservas;2.231,71
Choritos En Aceite Y Ag Robinson Cr Lat 190 Grm;Conservas;2.136,93
Choritos Al Natural Robinson Cr Lat 190 Grm;Conservas;2.136,93
Maiz Dulce Bonduelle 225 Gr;Conservas;2.312,76
Atun Al Natural GOMES DA COSTA Lomo Lata 170 Gr;Conservas;1.414,99
Atun En Aceite GOMES DA COSTA Lomitos Lata 170 Gr;Conservas;1.414,99
Atun En Aceite CIUDAD DEL LAGO En Trozos Lata 170 Gr;Conservas;1.428,60
Atun Al Natural CIUDAD DEL LAGO En Trozos Lata 170 Gr;Conservas;1.428,60
Porotos Rojos En Conserva BONDUELLE Lat 400 Grm;Conservas;2.991,99
Surt.Mariscos En Aceite Y Ag Robinson Cr Lat 190 Grm;Conservas;2.473,63
Atun Al Natural COTO Lomitos Lata 165 Gr;Conservas;1.469,36
Palmitos Enteros CIUDAD DEL LAGO Lata 400 Gr;Conservas;2.753,77
Lomitos De Atún En Aceite Y Agua 165 Gr;Conservas;1.555,59
Atun Claro En Aceite Y Agua Coto Lat 185 Grm;Conservas;1.819,42
Cholgas Con Aceite Y A Robinson Cr Lat 190 Grm;Conservas;2.473,63
Cholgas Al Natural Robinson Cr Lat 190 Grm;Conservas;2.544,98
Pimiento Morron Enteros COTO Frasco 220 Gr;Conservas;1.776,64
Zanahorias Dulces En Agua Y Vinagre Künhe 330g;Conservas;4.530,33
Atun Claro En Aceite De Oliva Y Agua Coto Lat 185 Grm;Conservas;2.032,13
Lomitos Atún En Aceite De Oliva Y Agua Robinson Crusoe Lat 130 Grm;Conservas;1.917,76
Atun En Aceite Pennisi 170 Grm;Conservas;1.884,35
Calamar En Aceite Pennisi 115gr;Conservas;1.813,68
Atun Desmenuzado Al Agua Pennisi 170 Grm;Conservas;1.884,35
Calamar En Trozos En Tinta Robinson Crusoe Lat 111 Grm;Conservas;1.958,66
Choclo Enteros BONDUELLE Lata 300 Gr;Conservas;5.059,76
Remolacha En Cubos BONDUELLE   Lata 400 Gr;Conservas;4.735,58
Palmitos Enteros COTO Lata 400 Gr;Conservas;3.971,59
Arveja BONDUELLE Lata 400 Gr;Conservas;5.074,27
Macedonia BONDUELLE Lata 400 Gr;Conservas;4.856,54
Zanahoria BONDUELLE Extra Fina Lata 400 Gr;Conservas;4.871,06
Pepinito Vinagre Nucete 150gr;Encurtidos;40,77
Aceitunas Verdes NUCETE       Sachet 800 Gr;Encurtidos;1.307,92
Aceitunas Verdes En Salmuera NUCETE 220g;Encurtidos;472,72
Aceitunas Verdes Para Ensaladas NUCETE 220g;Encurtidos;472,72
Aceitunas Verdes Rellena Yovinessa Doy 290 Grm;Encurtidos;665,27
Aceitunas Verdes Descarozadas NUCETE 220g;Encurtidos;552,46
Aceitunas Negras En Salmuera Nucete 220 Grm;Encurtidos;582,84
Aceitunas Verdes Cébila 180g;Encurtidos;478,44
Aceitunas Verdes Desc.Premium Yovinessa Fra 360 Grm;Encurtidos;974,03
Aceitunas Verdes En Rodajas Nucete 220 Grm;Encurtidos;613,19
Aceitunas Verdes Premium Yovinessa Fra 660 Grm;Encurtidos;1.855,79
Aceitunas Verdes Cébila 100 Gr;Encurtidos;290,60
Aceitunas Verdes Rellenas Con Pasta De Morrón Nucete 220 Grm;Encurtidos;645,40
Pickles Mixtos En Vinagre Nucete 220 Grm;Encurtidos;666,35
Aceitunas Verdes Rellenas Cébila 180 Gr;Encurtidos;580,52
Aceitunas Verdes Rellena Yovinessa Fra 360 Grm;Encurtidos;1.184,73
Aceitunas Verdes Premium Yovinessa Fra 360 Grm;Encurtidos;1.202,52
Aceitunas Verdes Descarozadas Cébila 150 Gr;Encurtidos;512,36
Aceitunas Verdes Rellenas Cébila 100 Gr;Encurtidos;353,84
Aceitunas Verdes Vanoli 300g;Encurtidos;715,29
Aceitunas Verdes Descarozadas Cébila 80 Gr;Encurtidos;320,86
Aceitunas Verdes YOVINESSA       Pouch 900 Gr;Encurtidos;2.089,72
Aceitunas Verdes YOVINESSA Sachet 130 Gr;Encurtidos;427,90
Pickles En Vinagre VANOLI   Pouch 300 Gr;Encurtidos;645,95
Aceitunas Verdes NUCETE   Descarozada    Sachet 180 Gr;Encurtidos;353,14
Aceitunas Verdes VANOLI Pouch 150 Gr;Encurtidos;360,81
Aceitunas Verdes Premium Castell Fra 340 Grm;Encurtidos;1.652,57
Aceituna Verde Castell 300gr;Encurtidos;903,14
Aceitunas Negras Premium Castell Fra 340 Grm;Encurtidos;1.752,27
Aceitunas Verdes NUCETE       Frasco 330 Gr;Encurtidos;1.050,04
Aceitunas Verdes Rellenas Con Pasta De Ajo Nucete 330 Grm;Encurtidos;1.779,76
Aceitunas Verdes Rellenas Con Pasta Sabor Limón Nucete 330 Grm;Encurtidos;1.779,76
Aceitunas Verdes Rellenas Con Pasta De Cebolla Nucete 330 Grm;Encurtidos;1.779,76
Aceitunas Verdes Rellenas Con Pasta De Jalapeño Nucete 330 Grm;Encurtidos;1.779,76
Aceitunas Verdes Rellena Castell Fra 340 Grm;Encurtidos;1.850,50
Aceitunas Negras Vanoli 150 Gr;Encurtidos;435,88
Aceitunas Verdes NUCETE     Premium Frasco 360 Gr;Encurtidos;1.219,47
Aceitunas Verdes CASTELL       Pouch 200 Gr;Encurtidos;558,52
Aceitunas Verdes VANOLI Rellena Morrones Descarozada    Pouch 300 Gr;Encurtidos;1.017,69
Aceitunas Negras NUCETE       Frasco 330 Gr;Encurtidos;1.155,39
Pickles En Vinagre VANOLI   Frasco 330 Gr;Encurtidos;1.174,06
Aceitunas Verdes A La It Castell Fra 340 Grm;Encurtidos;2.016,32
Aceitunas Verdes Vanoli Tradicional 330 Gr;Encurtidos;1.196,04
Pasta De Aceitunas Negras VANOLI       Frasco 170 Gr;Encurtidos;1.018,08
Aceitunas Negras CASTELL Pouch 300 Gr;Encurtidos;1.089,93
Aceitunas Verdes VANOLI   Descarozada    Pouch 150 Gr;Encurtidos;488,84
Aceitunas Negras A La It Castell Fra 340 Grm;Encurtidos;2.139,46
Aceituna Verde Descarozadas Castell 850gr;Encurtidos;2.522,38
Aceitunas Verdes Descarozadas Nucete 360g;Encurtidos;1.167,77
Aceitunas Verdes YOVINESSA    En Rodajas   Sachet 80 Gr;Encurtidos;534,18
Aceitunas Negras CASTELL Pouch 200 Gr;Encurtidos;674,35
Aceitunas Verdes YOVINESSA   Descarozada    Sachet 150 Gr;Encurtidos;547,97
Aceitunas Rellenas Con Morrones Castell 300gr;Encurtidos;1.235,34
Aceitunas Verdes NUCETE Rellena Morrones   Premium Frasco 360 Gr;Encurtidos;1.523,33
Aceitunas Verdes CASTELL    En Rodajas   Pouch 300 Gr;Encurtidos;1.054,74
Aceitunas Negras Descarozadas Nucete 360g;Encurtidos;1.281,45
Aceitunas Verdes NUCETE   Descarozada    Frasco 330 Gr;Encurtidos;1.155,39
Aceitunas Verdes CASTELL    En Rodajas   Pouch 180 Gr;Encurtidos;579,26
Aceituna Verde Descarozadas Castell 300gr;Encurtidos;1.110,69
Aceitunas Verdes VANOLI     Línea Selecta Frasco 320 Gr;Encurtidos;1.493,36
Aceitunas Verdes Premium Castell 340g;Encurtidos;2.553,07
Aceitunas Verdes Rellenas Premium Castell 340g;Encurtidos;2.582,16
Cebollitas Vanoli En Vinagre 330 Gr;Encurtidos;1.519,40
Aceitunas Negras Premium Castell 340g;Encurtidos;2.596,22
Aceitunas Verdes CASTELL Rellena Morrones     Pouch 200 Gr;Encurtidos;801,05
Ajíes En Vinagre CASTELL 300 Grm;Encurtidos;2.429,79
Aceitunas Verdes YOVINESSA Premium Frasco 660 Gr;Encurtidos;3.246,38
Aceitunas Verdes Vanoli Rellenas 330 Gr;Encurtidos;1.646,59
Aceitunas Verdes Descarozadas Castell 180gr;Encurtidos;662,35
Aceitunas Verdes VANOLI En Rodajas Frasco 330 Gr;Encurtidos;1.384,27
Aceitunas Negras VANOLI       Frasco 330 Gr;Encurtidos;1.752,20
Encurtido Pimienta Malagueta Cepera 50 Grm;Encurtidos;4.945,72
Aceitunas Verdes A La Italiana Castell 340g;Encurtidos;3.427,14
Aceitunas Verdes YOVINESSA Premium Frasco 330 Gr;Encurtidos;2.020,76
Aceitunas Negras A La Italiana Castell 340g;Encurtidos;3.519,34
Aceitunas Verdes Rellenas Con Morrón Yovinessa 330g;Encurtidos;2.215,40
Aceitunas Verdes YOVINESSA Descarozada Frasco 330 Gr;Encurtidos;1.828,92
Aceitunas Negras YOVINESSA Frasco 330 Gr;Encurtidos;2.389,27
Aceitunas Rellenas Con Pasta De Limon Stabz 200 Grm;Encurtidos;2.457,26
Aceitunas Rellenas Con Alcaparras Stabz Lat 200 Grm;Encurtidos;2.457,26
Aceitunas Rellenas Con Pimientos Stabz Lat 200 Grm;Encurtidos;2.457,26
Aceitunas Rellenas Con Salmón Stabz Lat 200 Grm;Encurtidos;2.457,26
Aceitunas Rellenas Con Jalapeños Stabz Lat 200 Grm;Encurtidos;2.457,26
Aceitunas Rellenas Con Anchoas Stabz 200 Grm;Encurtidos;2.457,26
Harina Trigo 000 Morixe Paq 1 Kgm;Harinas;225,41
Harina De Trigo CHACABUCO  000 Paquete 1 Kg;Harinas;236,16
Harina Trigo 000 BLANCAFLOR 1 Kg;Harinas;246,90
Harina Trigo Integral MORIXE Paq 1 Kg;Harinas;303,51
Harina Integral . Pureza Paq 1 Kgm;Harinas;327,67
Harina Tipo 0000 Cañuelas Paq 1 Kgm;Harinas;371,48
Harina Trigo CASERITA Paq 1 Kgm;Harinas;372,07
Harina Trigo 000 Fortivac Morixe Paq 1 Kgm;Harinas;382,43
Harina Leudante CAÑUELAS 1kg;Harinas;428,09
Harina Trigo 0000 Fortivac Morixe Paq 1 Kgm;Harinas;450,53
Harina Con Levadura Morixe  Paquete 1 Kg;Harinas;453,88
Polenta Coto 1kg;Harinas;455,10
Harina 0000 Fortificada Pureza 1kg;Harinas;473,29
Harina Con Levadura PUREZA Para Pan Paquete 1 Kg;Harinas;477,81
Premezcla Para Pizza PUREZA Leudante Paquete 1 Kg;Harinas;477,81
Harina Integral Fuente De Fibra Blancaflor 1kg;Harinas;489,24
Harina De Trigo 0000 Caserita Paq 1 Kgm;Harinas;504,10
Polenta Super Rapida Coto 500g;Harinas;256,44
Harina De Trigo CHACABUCO 0000 Paquete 1 Kg;Harinas;520,13
Harina Integral Para Pizzas Con Levadura Pureza Paq 1 Kgm;Harinas;525,47
Harina Maiz . Rivara Paq 1 Kgm;Harinas;527,98
Caserita Pizza Caserita Paq 1 Kgm;Harinas;529,44
Harina Leudante Fortivac Morixe Paq 1 Kgm;Harinas;532,93
Polenta DEL CAMPO Paquete 500 Gr;Harinas;281,19
Harina Leudante Fortificada Pureza 1kg;Harinas;563,98
Harina Leudante Caserita 1 Kgm;Harinas;593,44
Polenta Instantanea Mamá Cocina 500g;Harinas;298,29
Premezcla Para Pizza Mamá Cocina Paq 500 Grm;Harinas;307,09
Harina De Trigo CHACABUCO Leudante Paquete 1 Kg;Harinas;628,99
Harina Integral Fina CHACABUCO Paq 1 Kgm;Harinas;641,09
Harina Para Pizzas Caseras Con Masa Madre Pureza 1kg;Harinas;666,67
Harina Para Masa Madre Chacabuco Paq 1 Kgm;Harinas;671,33
Semolin De Trigo Pan Chacabuco Paq 1 Kgm;Harinas;671,33
Saborizada Chacabuco  Paquete 1 Kg;Harinas;677,38
Polenta Instantanea Presto Pronta Paq 730 Grm;Harinas;511,32
Premezcla Para Pizza PUREZA Paquete 550 Gr;Harinas;468,64
Premezcla Para Pizza PUREZA Integral Paquete 550 Gr;Harinas;498,50
Polenta Presto Pronta 500 Grm;Harinas;516,96
Fécula De Maíz Dicomere 450 Grm;Harinas;499,00
Harina Integral + Semillas Chacabuco Paq 750 Grm;Harinas;834,62
Harina De Trigo Chacabuco  Paquete 750 Gr;Harinas;834,62
Harina De Trigo Chacabuco  Paquete 750 Gr;Harinas;834,62
Semola ELIO De Trigo Paquete 400 Gr;Harinas;491,93
Harina De Arroz Dicomere 1 Kg;Harinas;1.299,00
Premezcla Para Pizza Gourmet Masa Madre Pureza 550g;Harinas;794,70
Premezcla Para Ñoquis MAMÁ COCINA Espinaca Paquete 400 Gr;Harinas;610,61
Premezcla Para Tortas Fritas Lucchetti 500g;Harinas;809,35
Harina De Arroz DOS HERMANOS Paquete 500 Gr;Harinas;838,83
Semola LUCCHETTI Vitina  250 Gr;Harinas;473,54
Harina De Garbanzo Sturla 250gr;Harinas;549,00
Harina De Arvejas Dicomere 450g;Harinas;999,00
Polenta Con Salsa Bolognesa Mamá Cocina 200g;Harinas;477,37
Harina De Arroz DIMAX 500 Gr;Harinas;1.225,10
Carne Vegetal Soja Texturizada Dicomere 350 Grm;Harinas;899,00
Premezcla Para Pizza Lucchetti 850g;Harinas;2.201,35
Harina De Lino Sturla 250gr;Harinas;649,00
Couscous Original Mamá Cocina 200 Grm;Harinas;519,77
Harina De Trigo Sarraceno Integral Dicomere 450g;Harinas;1.299,00
Premezcla Para Crepes Veggie NATURAL POP Paq 200 Grm;Harinas;578,78
Premezcla Para Hamburguesa NATURAL POP Paq 200 Grm;Harinas;659,05
Premezcla Para Ñoquis De Papa Lucchetti 500g;Harinas;1.664,95
Harina De Garbanzo Dicomere 450g;Harinas;1.499,00
Polenta Mediterranea Mole Paq 200 Grm;Harinas;697,49
Premezcla Falafel Arvejas Y Quinoa Natural Pop 220g;Harinas;814,94
Harina De Arroz Integral Yamani Dicomere 450g;Harinas;1.699,00
Premezcla Para Crepes Veggie Natural Pop 210g;Harinas;796,74
Premezcla Para Faina Natural Pop 210g;Harinas;816,16
Premezcla Para Hamburguesa Vegetal Natural Pop 210g;Harinas;816,16
Harina De Amaranto Sturla 250gr;Harinas;999,00
Premezcla Para Pizza Naturalsur Cja 500 Grm;Harinas;2.032,26
Premezcla Para Falafel Natural Pop 200g;Harinas;816,16
Premezcla Para Pan Ingles Naturalsur Cja 350 Grm;Harinas;1.457,48
Premezcla Para Pan Integral Naturalsur Cja 350 Grm;Harinas;1.457,48
Semola Rimacinata Bonalma 1 Kgm;Harinas;4.191,26
Semola Bonalma 500 Grm;Harinas;2.136,27
Harina De Lentejas Dicomere 450g;Harinas;1.999,00
Fécula De Mandioca Dicomere 450 Grm;Harinas;2.099,00
Couscous Limón Y Menta Box 89 Grm;Harinas;462,61
Couscous Crema De Vegetales Box 89 Grm;Harinas;462,61
Couscous Marroqui Box 89 Grm;Harinas;462,61
Fécula De Papa Dicomere 450g;Harinas;2.399,00
Premezcla Hummus Instantaneo Natural Pop 105g;Harinas;585,28
Polenta Con Salsa Rosa Box 75g;Harinas;419,40
Polenta Con Salsa De Vegetales Box 75g;Harinas;419,40
Mermelada Naranja Arcor Fra 454 Grm;Mermeladas-y-dulces;473,12
Mermelada Light Durazno Arcor Fra 390 Grm;Mermeladas-y-dulces;753,49
Mermelada Ciruela EMETH    Pote 420 Gr;Mermeladas-y-dulces;854,70
Mermelada Light Sabor Frutilla EMETH 420g;Mermeladas-y-dulces;854,70
Mermelada Ciruela EMETH   Light Pote 420 Gr;Mermeladas-y-dulces;854,70
Mermelada Durazno EMETH   Light Pote 420 Gr;Mermeladas-y-dulces;854,70
Mermelada Durazno Emeth Pot 420 Grm;Mermeladas-y-dulces;854,70
Mermelada Frutillas EMETH    Pote 420 Gr;Mermeladas-y-dulces;854,70
Mermelada Damasco Bc La Campagnola Fra 390 Grm;Mermeladas-y-dulces;882,45
Mermelada Naranja DULCOR    Frasco 454 Gr;Mermeladas-y-dulces;1.030,04
Mermelada Sabor Frambuesa Emeth 420gr;Mermeladas-y-dulces;980,12
Frutilla Enteras Comunes Bahia 850 Grm;Mermeladas-y-dulces;2.103,33
Mermelada Sabor Damasco Cormillot 390g;Mermeladas-y-dulces;1.110,91
Mermelada Sabor Ciruela Cormillot 390g;Mermeladas-y-dulces;1.110,91
Mermelada Sabor Pera Caroyense 454 Grm;Mermeladas-y-dulces;1.295,17
Mermelada Damasco CAROYENSE Frasco 454 Gr;Mermeladas-y-dulces;1.295,17
Mermelada Sabor Ciruela Caroyense 454g;Mermeladas-y-dulces;1.295,17
Mermelada Sabor Durazno Caroyense 454 Grm;Mermeladas-y-dulces;1.295,17
Mermelada Naranja Bc La Campagnola Fra 390 Grm;Mermeladas-y-dulces;1.115,88
Mermelada Light Frutilla ESNAOLA Fra 390 Grm;Mermeladas-y-dulces;1.268,24
Mermelada Sabor Durazno CAROYENSE 390g;Mermeladas-y-dulces;1.295,17
Mermelada Light Sabor Pera Caroyense 390 Grm;Mermeladas-y-dulces;1.295,17
Mermelada Sabor Frutilla Cormillot 390g;Mermeladas-y-dulces;1.308,51
Mermelada Arándanos Bc La Campagnola Fra 390 Grm;Mermeladas-y-dulces;1.368,66
Mermelada Durazno Selección La Campagnola Fra 390 Grm;Mermeladas-y-dulces;1.396,71
Mermelada Dietética Membrillo Cormillot 330g;Mermeladas-y-dulces;1.184,11
Mermelada Ciruela EMETH    Frasco 454 Gr;Mermeladas-y-dulces;1.642,46
Mermelada Durazno EMETH    Frasco 454 Gr;Mermeladas-y-dulces;1.642,46
Mermelada Sabor Damasco Emeth 450g;Mermeladas-y-dulces;1.642,46
Mermelada Sabor Naranja Emeth 450g;Mermeladas-y-dulces;1.642,46
Mermelada Sabor Arándano Cormillot 390g;Mermeladas-y-dulces;1.489,29
Miel Orgánica De Yunga Premium LOS AMARILLOS 470 Grm;Mermeladas-y-dulces;1.799,00
Mermelada Sabor Membrillo Caroyense 454 Grm;Mermeladas-y-dulces;1.773,54
Mermelada Arandanos CAROYENSE Frasco 454 Gr;Mermeladas-y-dulces;1.773,54
Mermelada Sin Azucar Sabor Durazno Cormillot 390g;Mermeladas-y-dulces;1.525,18
Mermelada Frutillas EMETH    Frasco 450 Gr;Mermeladas-y-dulces;1.768,21
Mermelada Frambuesas Emeth Frasco 454 Gr;Mermeladas-y-dulces;1.789,54
Mermelada Arandano Emeth 454gr;Mermeladas-y-dulces;1.796,14
Mermelada Frutos Del Bosque EMETH    Frasco 454 Gr;Mermeladas-y-dulces;1.796,15
Miel NÉCTAR DE LOS DIOSES   Pouch 500 Gr;Mermeladas-y-dulces;2.059,31
Mermelada Emeth Maracuya Fra 454 Grm;Mermeladas-y-dulces;1.875,02
Mermelada Durazno EMETH   Light Frasco 390 Gr;Mermeladas-y-dulces;1.620,43
Mermelada Naranja EMETH   Light Frasco 390 Gr;Mermeladas-y-dulces;1.620,43
Mermelada Light Sabor Ciruela Emeth 390gr;Mermeladas-y-dulces;1.620,43
Mermelada Frutilla Selección La Campagnola Fra 390 Grm;Mermeladas-y-dulces;1.641,64
Miel Orgánica Premi Yunga Andin Fra 470 Grm;Mermeladas-y-dulces;1.999,00
Confitura Manzana El Bolson Fra 454 Grm;Mermeladas-y-dulces;1.979,29
Mermelada Frutos Del Bosque Emeth  Light Frasco 390 Gr;Mermeladas-y-dulces;1.742,03
Mermelada Frutillas EMETH   Light Frasco 390 Gr;Mermeladas-y-dulces;1.742,04
Mermelada Arandanos EMETH   Light Frasco 390 Gr;Mermeladas-y-dulces;1.742,04
Mermelada Sabor Frambuesa Cormillot 390g;Mermeladas-y-dulces;1.764,23
Miel Orgánica Premi Los Amarill Fra 330 Grm;Mermeladas-y-dulces;1.499,00
Mermelada Frutos Del Bosque CAROYENSE Light Frasco 390 Gr;Mermeladas-y-dulces;1.773,54
Mermelada Light Sabor Arándano Caroyense 390 Grm;Mermeladas-y-dulces;1.773,54
Mermelada Light Sabor Frutilla Caroyense 390 Grm;Mermeladas-y-dulces;1.773,54
Mermelada Sabor Ciruela Caroyense 390g;Mermeladas-y-dulces;1.773,54
Mermelada Sabor Frambuesa Light EMETH 390gr;Mermeladas-y-dulces;1.821,24
Miel Liq/Dosi LIEBIG Fra 500 Gr;Mermeladas-y-dulces;2.389,78
Miel NÉCTAR DE LOS DIOSES 500 Gr;Mermeladas-y-dulces;2.400,33
Miel NÉCTAR DE LOS DIOSES Pote 500 Gr;Mermeladas-y-dulces;2.400,33
Miel Cremosa Nectar De Los Dioses Fra 500 Grm;Mermeladas-y-dulces;2.446,49
Miel Cremosa Montecitos 500g;Mermeladas-y-dulces;2.452,72
Mermelada Maracuya EMETH   Light Frasco 390 Gr;Mermeladas-y-dulces;1.916,23
Mermelada Dietética Durazno Cuartocreciente Fra 400 Grm;Mermeladas-y-dulces;1.966,65
Confitura De Mosqueta El Bolson Fra 454 Grm;Mermeladas-y-dulces;2.305,77
Dulce De Manzanas Herencia 350 Grm;Mermeladas-y-dulces;1.799,45
Miel Orgánica Premi Yunga Andin Fra 330 Grm;Mermeladas-y-dulces;1.699,00
Mermelada Ciruela Y Nara El Brocal Fra 420 Grm;Mermeladas-y-dulces;2.239,09
Mermelada Ciruela EL BROCAL Frasco 420 Gr;Mermeladas-y-dulces;2.239,09
Mermelada Naranja EL BROCAL Frasco 420 Gr;Mermeladas-y-dulces;2.239,09
Mermelada Sin Azucar Sabor Frutilla Cormillot 390g;Mermeladas-y-dulces;2.117,61
Confitura Arandano El Bolson Fra 454 Grm;Mermeladas-y-dulces;2.478,57
Miel TREBOLAR    250 Gr;Mermeladas-y-dulces;1.372,32
Mermelada Dietética Frutos Rojos Cuartocreciente Fra 400 Grm;Mermeladas-y-dulces;2.214,57
Mermelada Dietética Sabor Arandano Cuartocreciente Fra 400 Grm;Mermeladas-y-dulces;2.214,57
Mermelada Dietética Frutilla Cuartocreciente Fra 400 Grm;Mermeladas-y-dulces;2.214,57
Confitura Frutos Del Bosque El Bolson Fra 450 Grm;Mermeladas-y-dulces;2.533,81
Confitura Durazno El Bolson 450 Gr;Mermeladas-y-dulces;2.546,51
Miel Orgánica Nectar De Los Dioses Fra 500 Grm;Mermeladas-y-dulces;2.901,94
Pasta De Maní Crunchy Maní King 350g;Mermeladas-y-dulces;2.060,37
Mermelada Pera El Brocal 420g;Mermeladas-y-dulces;2.527,46
Confitura Frutilla El Bolson Fra 454 Grm;Mermeladas-y-dulces;2.754,24
Miel Liquida Aleluya 500 Gr;Mermeladas-y-dulces;3.076,13
Miel Cremosa Montecitos 300g;Mermeladas-y-dulces;1.891,34
Miel NÉCTAR DE LOS DIOSES Untable Pouch 150 Gr;Mermeladas-y-dulces;946,09
Mermelada Sabor Frambuesa Cormillot 390g;Mermeladas-y-dulces;2.545,86
Pasta De Maní 100% Natural Dec Alimentos 350g;Mermeladas-y-dulces;2.284,87
Mermelada Frutillas EL BROCAL Frasco 420 Gr;Mermeladas-y-dulces;2.749,85
Miel Untable Aleluya 500 Gr;Mermeladas-y-dulces;3.279,23
Mermelada Light Mermelada Durazno Con Semillas Cuartocreciente Fra 400 Grm;Mermeladas-y-dulces;2.626,92
Miel Liquida Aleluya 500 Gr;Mermeladas-y-dulces;3.375,11
Miel Liquida Montecitos 350g;Mermeladas-y-dulces;2.366,27
Mermelada Arandanos EL BROCAL    Frasco 420 Gr;Mermeladas-y-dulces;2.844,54
Mermelada Ciruela El Brocal 400g;Mermeladas-y-dulces;2.713,85
Miel Liquida Aleluya 470 Gr;Mermeladas-y-dulces;3.255,53
