Product;Category;Price
Vino Cab.Sauv . Angelica Za Bot 750 Cmq;Bebidas-con-alcohol;10.773,94
Vino Merlot . Angelica Za Bot 750 Cmq;Bebidas-con-alcohol;10.773,94
Vodka Absolut Bot 700 Ml;Bebidas-con-alcohol;10.064,91
Champaña Extra Brut Rutini Bot 750 CC;Bebidas-con-alcohol;10.868,07
Whisky Blended Scotch Ballantines Bot 700 Ml;Bebidas-con-alcohol;10.145,61
Vino Malbec Orgánico Argento S Block Altamira 750cc;Bebidas-con-alcohol;11.036,90
ABSOLUT Apeach Vodka Suecia Botella De 750 Ml;Bebidas-con-alcohol;11.213,83
Pisco Especial CAPEL 700 Ml;Bebidas-con-alcohol;10.630,57
Vino Malbec Old Vine Luca Bot 750 Ml;Bebidas-con-alcohol;12.328,98
Vino Malbec Alta Pascual Toso 750 Ml;Bebidas-con-alcohol;11.423,45
Vino Tinto Blend Heroes 750 Ml;Bebidas-con-alcohol;12.457,17
Espumante Extra Brut Luigi Bosca 750ml;Bebidas-con-alcohol;11.580,18
Vino Malbec Malbec Dv Catena 1500 Ml;Bebidas-con-alcohol;23.343,56
Vino Chardonnay Luca Bot 750 Ml;Bebidas-con-alcohol;12.702,39
Gin + Copa Heredero 700 Ml;Bebidas-con-alcohol;10.982,56
Licor Pesado Salted Caramel Baileys Scrumptious Bot 750 Ml;Bebidas-con-alcohol;11.780,08
Champaña Blanc De Blanc ALMA NEGRA Bot 750 Cmq;Bebidas-con-alcohol;12.791,41
Vino Cabernet Franc Numina Salentein Bot 750 Ml;Bebidas-con-alcohol;11.880,00
Champaña Brut Nat Alma Negra Bot 750 Cmq;Bebidas-con-alcohol;12.864,92
Vodka Mandrin Absolut 700 Ml;Bebidas-con-alcohol;11.213,83
Vino Malbec Gran Reserva Humberto Ca Bot 750 Ml;Bebidas-con-alcohol;12.023,85
Vino Merlot Gran Reserva Marcus 750 Ml;Bebidas-con-alcohol;12.023,85
Vino F.Tinto Centenario Perdriel Bot 750 Cmq;Bebidas-con-alcohol;12.038,25
Gin Andes Dry Belladonna 1 Ltr;Bebidas-con-alcohol;17.336,59
Licor Pesado Crema Bailey'S Bot 750 Cmq;Bebidas-con-alcohol;12.043,39
Espumante Baron B Brut Nature 750 CC;Bebidas-con-alcohol;12.075,92
Espumante Baron B Brut Rosé 750 Cc;Bebidas-con-alcohol;12.075,92
Vino Blend . ALMA NEGRA Bot 750 Cmq;Bebidas-con-alcohol;13.085,45
Gin Moksha 750ml;Bebidas-con-alcohol;12.317,13
Vino Malbec Amorio TIKAL Bot 750 Cmq;Bebidas-con-alcohol;13.379,52
Whisky Irish Jameson Bot 700 Ml;Bebidas-con-alcohol;11.577,97
Gin London Dry BEEFEATER Bot 700 Ml;Bebidas-con-alcohol;11.579,77
Vino Malbec . El Enemigo Bot 750 Cmq;Bebidas-con-alcohol;12.569,62
Vino Cabernet Fran . EL ENEMIGO Bot 750 Ml;Bebidas-con-alcohol;12.569,62
Vino Malbec . RUTINI Bot 750 Cmq;Bebidas-con-alcohol;12.575,07
Vino Malbec . Flia Schroe Bot 750 Ml;Bebidas-con-alcohol;13.637,33
Vino Pinot Malbec Flia Schroe Bot 750 Cmq;Bebidas-con-alcohol;13.637,33
Vino Pinot Noir Gran Reserva Humberto Ca Bot 750 Ml;Bebidas-con-alcohol;12.658,89
Espumante Extra Brut+Copas Chandon Est 750 Ml;Bebidas-con-alcohol;12.751,60
Vino Malbec Doc LAGARDE Bot 750 Cmq;Bebidas-con-alcohol;13.802,61
Vino Crianza . Lagarde Bot 750 Cmq;Bebidas-con-alcohol;13.802,61
Vino Cab Franc Guarda LAGARDE Bot 750 Ml;Bebidas-con-alcohol;13.802,61
Vino Tinto Origen 1868 Goyenechea 750 Ml;Bebidas-con-alcohol;13.970,88
Champaña Nature Luigi Bosca Brut 750 CC;Bebidas-con-alcohol;12.986,57
Vino Blend Jubilo Tikal Bot 750 Cmq;Bebidas-con-alcohol;14.041,14
Vino Cabernet Cabernet Dv Catena Bot 750 Cmq;Bebidas-con-alcohol;13.018,53
Vino Malbec Doc DV CATENA Bot 750 Cmq;Bebidas-con-alcohol;13.018,53
Vino Malbec Gran Reserva Escorihuela Gascón 750 Ml;Bebidas-con-alcohol;13.069,12
Vino Blend Of Vineyards Malbec Cadus X750 Ml;Bebidas-con-alcohol;14.131,90
Pisco Reservado Transparente CAPEL 700 Ml;Bebidas-con-alcohol;12.265,16
Ron Signature Blen Appleton St Bot 750 Ml;Bebidas-con-alcohol;13.205,41
Brandy French Bardinet 700 CC;Bebidas-con-alcohol;13.330,50
Whisky . Sir Edward  Bot 700 Cmq;Bebidas-con-alcohol;13.330,50
Gin Rosé Fresas Larios Bot 700 Ml;Bebidas-con-alcohol;12.455,67
Vino Rosé Pinot Noir Cuchillo De Palo 750 Ml;Bebidas-con-alcohol;14.469,40
Whisky JOHNNIE WALKER  1 L Red Label;Bebidas-con-alcohol;17.891,90
Vino Tinto Aminga 750 Ml;Bebidas-con-alcohol;14.562,74
Vino F.Tinto . NUMINA Bot 750 Cmq;Bebidas-con-alcohol;13.500,00
Vino Petit Verdot . VIA FLAVIA Bot 750 Ml;Bebidas-con-alcohol;14.614,51
D. V. CATENA Nature 750 Ml;Bebidas-con-alcohol;13.691,78
Vino Cabernet Franc Angelica Za Bot 750 Cmq;Bebidas-con-alcohol;13.916,35
Gin London Dry Tanqueray Bot 700 Ml;Bebidas-con-alcohol;13.029,98
Ron Añejo BOTRAN Bot 750 Ml;Bebidas-con-alcohol;15.083,14
Licor Crema Dulce De Leche WILD AFRICA Bot 750 Ml;Bebidas-con-alcohol;15.234,87
Vino Rosado Cab-Fr Blanc De Franc ANDELUNA Bot 750 Ml;Bebidas-con-alcohol;15.235,60
Vino Malbec Fumata Bianca 750ml;Bebidas-con-alcohol;15.422,40
Vino Cabernet Franc Fumata Bianca 750ml;Bebidas-con-alcohol;15.422,40
Vino Malbec Heritage LA CELIA Bot 750 CC;Bebidas-con-alcohol;14.292,97
Whisky Jim Beam 750 Ml;Bebidas-con-alcohol;14.387,47
Whisky JIM BEAM 750 ML;Bebidas-con-alcohol;14.387,47
Vino Semillon Estuche Saint Felicien 500 Cmq;Bebidas-con-alcohol;9.651,67
Licor Liviano Lemoncello Strega Bot 700 Ml;Bebidas-con-alcohol;14.966,22
Vino Cab.Sauv Estuche Saint Felic X 2 Bot 750 Cmq;Bebidas-con-alcohol;15.038,65
Whisky Johnnie Walker 750 Ml Red Label;Bebidas-con-alcohol;15.057,94
Vino Cabernet Sauvignon Malbec Petit Caro Bot 750 Ml;Bebidas-con-alcohol;16.543,11
Vino Terrazas De Los Andes Grand Malbec 750ml;Bebidas-con-alcohol;15.367,97
Vino Terrazas De Los Andes Grand Cabernet Sauvignon 750ml;Bebidas-con-alcohol;15.367,97
Gin Dark Berry Roy Tanqueray 700 Ml;Bebidas-con-alcohol;14.455,10
Gin Flor De Sevilla TANQUERAY 700ml;Bebidas-con-alcohol;14.471,21
Vino Cabernet Sauvignon Particular Bianchi 750cmq;Bebidas-con-alcohol;15.583,88
Vino Malbec Particular Bianchi 750cmq;Bebidas-con-alcohol;15.583,88
Licor Chocolate C/Crema De Vai Sheridans Bot 750 Ml;Bebidas-con-alcohol;15.603,85
Bourbon Finish 7 Años Ballantines Bot 700 Ml;Bebidas-con-alcohol;14.572,03
Licor Blend, Red Hot FIREBALL Bot 750 Ml;Bebidas-con-alcohol;17.139,22
Champaña Brut Nat Rutini Bot 750 Cmq;Bebidas-con-alcohol;15.893,78
Vino Cab/Mbec Estuche Catena Zapa Est 750 Cmq;Bebidas-con-alcohol;15.936,47
Vino Malbec Pequeñas Produ Peq. Produc Bot 750 Cmq;Bebidas-con-alcohol;16.136,37
Vino Cab.Sauv Pequeñas Produ Peq. Produc Bot 750 Cmq;Bebidas-con-alcohol;16.136,37
Grappa . CANDOLINI Bot 1 Ltr;Bebidas-con-alcohol;23.328,87
Vino Malbec La Rioja Dv Catena 750ml;Bebidas-con-alcohol;16.268,45
Vino Tinto Blend Beso De Dante Luca 750ml;Bebidas-con-alcohol;17.902,04
Vino Cabernet Sauvignon Appellation Tufungato Cadus 750ml;Bebidas-con-alcohol;17.910,91
Vino Malbec Appellation Tufangato Cadus 750ml;Bebidas-con-alcohol;17.910,91
Vino Chardonnay Appellation Cadus 750ml;Bebidas-con-alcohol;17.910,91
Tequila Esp. Cuervo Bot 750 Cmq;Bebidas-con-alcohol;16.965,41
Tequila Silver CUERVO 750 Cmq;Bebidas-con-alcohol;16.965,41
Whisky TULLAMORE DEW  750 CC Triple Distilled;Bebidas-con-alcohol;17.095,28
Vino Malbec Nicasia Vineya D.V. Catena Bot 750 Ml;Bebidas-con-alcohol;17.395,45
Vino Cabernet Sauvignon Nicasia Dv Catena Bot 750 Ml;Bebidas-con-alcohol;17.395,45
Vino Cabernet Sauvignon La Piramide Dv Catena Bot 750 Ml;Bebidas-con-alcohol;17.395,45
Gin 24 BEEFEATER Bot 750 Cmq;Bebidas-con-alcohol;17.583,08
Whisky Bourbon Brenchmark 750 CC;Bebidas-con-alcohol;19.043,58
Vino Chardonnay Primus Salentein Bot 750 Ml;Bebidas-con-alcohol;17.820,00
Vino DON ALFREDO Malbec Single Vineyard 750 Ml;Bebidas-con-alcohol;17.827,67
Whisky CHIVAS REGAL 12 Años 1 L;Bebidas-con-alcohol;23.795,85
Gin London Dry Bulldog Bot 700 Ml;Bebidas-con-alcohol;16.854,57
Cerveza Arcener Tripel HERTOG JAN   Porron 500 Cc;Bebidas-con-alcohol;13.231,02
Licor Livian Nja. Imp STREGA Bot 700 Cmq;Bebidas-con-alcohol;18.633,24
Sambuca . BORGHETTI Bot 700 Cmq;Bebidas-con-alcohol;18.747,29
Vino Malbec D.V. CATENA Adrianna Vineyard Bot 750 CC;Bebidas-con-alcohol;18.854,42
Vermouth Rosso Vicenzo 950ml;Bebidas-con-alcohol;23.948,87
Whisky Grand Old Parr 12 Años 750 Ml;Bebidas-con-alcohol;19.208,11
Ron Añejo,Gran Res SANTA TERESA Bot 750 Ml;Bebidas-con-alcohol;20.947,94
Gin London Dry Broker S 750 CC;Bebidas-con-alcohol;20.947,94
Gin . Bombay Sh Bot 750 Cmq;Bebidas-con-alcohol;19.475,48
Whisky Blended Scotch Chivas Regal Bot 700 Ml;Bebidas-con-alcohol;18.186,97
Vino Blend Presidents Ble Escorih Gas Bot 750 Ml;Bebidas-con-alcohol;19.670,37
Vino Malbec Cabernet Proyecto Hermanas Bot 750 Ml;Bebidas-con-alcohol;21.470,70
Vino Pinot Noir Proyecto Hermanas Bot 750 Ml;Bebidas-con-alcohol;21.470,70
Vino Blanco Blend Proyecto Hermanas Bot 750 Ml;Bebidas-con-alcohol;21.470,70
Vino Sauvignon Blanco Proyecto Hermanas Bot 750 Ml;Bebidas-con-alcohol;21.470,70
Gin Premium Brockmans Bot 700 Ml;Bebidas-con-alcohol;20.210,76
Vino Malbec . Angelica Za Bot 750 Cmq;Bebidas-con-alcohol;20.201,16
Vino Malbec Pasionado ANDELUNA Bot 750 Ml;Bebidas-con-alcohol;21.881,62
Vino Tinto Pasionado 4 Ce ANDELUNA Bot 750 Ml;Bebidas-con-alcohol;21.881,62
Whisky WILD TURKEY 750 ML American Honey;Bebidas-con-alcohol;20.684,73
Whisky WILD TURKEY 750 ML;Bebidas-con-alcohol;20.684,73
Ron Gran Reserva Flor De Caña Bot 750 Ml;Bebidas-con-alcohol;22.537,57
Jerez . TIO PEPE Bot 750 Cmq;Bebidas-con-alcohol;22.852,29
Vino Tinto Siglo Y 1/2 Goyenechea 750 Ml;Bebidas-con-alcohol;22.861,44
Whisky JACK DANIEL'S  750 CC Honey;Bebidas-con-alcohol;21.521,98
Whisky JACK DANIEL'S 750 CC;Bebidas-con-alcohol;21.521,98
Licor Livian Amareto DISARONNO Bot 750 Cmq;Bebidas-con-alcohol;24.756,66
Whisky Johnnie Walker 12 Años 1 L Black Label;Bebidas-con-alcohol;30.631,49
Gin Blackberry Raspberry Bombay Bramble 700 Ml;Bebidas-con-alcohol;21.495,29
Licor Liviano AMARULA Bot 750 CC;Bebidas-con-alcohol;23.376,64
Grapa Dv Catena Bot 500 Ml;Bebidas-con-alcohol;15.712,01
Vino Petit Verdot Via Flavia 750ml;Bebidas-con-alcohol;25.945,92
Vino F.Tinto Grand Vin Fabre Montm Bot 750 Cmq;Bebidas-con-alcohol;25.957,29
Licor A/Cogn . G.Marnier Bot 700 Cmq;Bebidas-con-alcohol;22.550,57
Brandy Osborne Veterano 700ml;Bebidas-con-alcohol;24.571,29
Whisky Extra 13 Años Chivas Regal 700 Ml;Bebidas-con-alcohol;22.835,69
Whisky Johnnie Walker 12 Años 750 Ml Black Label;Bebidas-con-alcohol;24.573,07
Grappa Rutini 500cmq;Bebidas-con-alcohol;16.610,11
Vino Blend . Gran Enemig Bot 750 Ml;Bebidas-con-alcohol;25.251,45
Vino Malbec The Presidents Escorihuela 750ml;Bebidas-con-alcohol;25.401,60
Vino Malbec Alta Angelica Zapata 750 Ml;Bebidas-con-alcohol;26.106,13
Vodka Elix Absolut Bot 1 Ltr;Bebidas-con-alcohol;34.943,16
Vino Bonarda Nicola Catena 750 Ml;Bebidas-con-alcohol;28.926,77
Licor A/Whis Crema Drambuie Bot 750 Cmq;Bebidas-con-alcohol;26.970,15
Vino Malbec Zuccardi 750 Ml;Bebidas-con-alcohol;28.191,75
Whisky 12 Años Singleton Bot 700 Ml;Bebidas-con-alcohol;26.666,10
Whisky MONKEY SHOULDER 700 Ml;Bebidas-con-alcohol;27.023,49
Whisky Johnnie Walker 750 Ml Double Black;Bebidas-con-alcohol;29.671,16
Vino Malbec . Salent. Pri Bot 750 Cmq;Bebidas-con-alcohol;31.320,00
Vino Pinot Noir Salent. Pri Bot 750 Cmq;Bebidas-con-alcohol;31.320,00
Whisky Xv Clear Chivas Regal 700 Ml;Bebidas-con-alcohol;29.481,16
Vino F.Tinto G Res 15 Años MONTCHENOT Est 750 Cmq;Bebidas-con-alcohol;34.413,47
Maria Carmen Reserva Chardonnay 750 CC;Bebidas-con-alcohol;31.950,01
Vino Malbec Iv Generación 753ml;Bebidas-con-alcohol;31.950,01
Vino Tinto Corte Iv Generación 754ml;Bebidas-con-alcohol;31.950,01
GIN MARE 700 CC;Bebidas-con-alcohol;33.200,96
Whisky Mizunara Chivas Rega Est 700 Ml;Bebidas-con-alcohol;31.248,57
Whisky MAKERS MARK 750 ML;Bebidas-con-alcohol;33.513,60
Ron 8añ/Añej Bacardi Bot 750 Cmq;Bebidas-con-alcohol;34.042,58
Vino Malbec PRIMERAS VIÑAS 750 CC;Bebidas-con-alcohol;36.806,92
Vodka . GREY GOOSE Bot 750 Cmq;Bebidas-con-alcohol;34.410,89
Vino Cabernet Primus Salentein Bot 750 Ml;Bebidas-con-alcohol;34.560,00
Whisky The Famous Grouse Bot 700 Ml;Bebidas-con-alcohol;34.892,64
Licor Livian Naranja COINTREAU Bot 700 Cmq;Bebidas-con-alcohol;36.182,80
Gin HENDRICKS 700 Ml;Bebidas-con-alcohol;33.757,45
HENNESSY V.S. Estuche 700 CC;Bebidas-con-alcohol;33.923,84
Gin Nordés 700 Ml;Bebidas-con-alcohol;38.327,20
Vino F.Tinto G Res 20 Años MONTCHENOT Est 750 Cmq;Bebidas-con-alcohol;41.502,91
Vermouth ANTICA FORMULA   Botella 1 L;Bebidas-con-alcohol;57.206,52
Vino Malbec Don Miguel Esc DON M.E.G. Bot 750 Cmq;Bebidas-con-alcohol;39.874,16
BELVEDERE Pure 700 CC;Bebidas-con-alcohol;38.572,33
Gin Original Malfy 700ml;Bebidas-con-alcohol;38.804,95
Gin Limone Malfy 700ml;Bebidas-con-alcohol;38.804,95
Gin Pink Malfy 700ml;Bebidas-con-alcohol;38.804,95
Gin Neptunia Hendricks 750 Ml;Bebidas-con-alcohol;41.960,91
Gin Lunar Hendricks 750 Ml;Bebidas-con-alcohol;41.960,91
Gin Limited Editio Bombay Shap Bot 700 Cmq;Bebidas-con-alcohol;41.069,76
Whisky SCAPA 700 CC Single Malt;Bebidas-con-alcohol;42.985,57
Vino Malbec Nico 750ml;Bebidas-con-alcohol;52.529,88
Whisky . J.Walker Sw Bot 750 Cmq;Bebidas-con-alcohol;49.479,29
Gin Monkey 47 500 Ml;Bebidas-con-alcohol;33.453,00
Whisky Johnnie Walker 750 Ml Gold Label Reserve;Bebidas-con-alcohol;52.486,87
Vino Malbec Argentino Catena Zapata 750 Cmq;Bebidas-con-alcohol;56.563,27
Glenmorangie Original Estuche 700 CC;Bebidas-con-alcohol;53.927,60
Vino Cabernet Malbec Catena Zapata 750 Ml;Bebidas-con-alcohol;58.596,07
Vino Fino Tinto Enzo Bianchi 750 Cmq;Bebidas-con-alcohol;63.900,01
Espumante Bottega 750ml;Bebidas-con-alcohol;73.637,85
Champagne Moet & Chandon Brut Impérial 750ml;Bebidas-con-alcohol;77.144,66
Champaña Pommery Imp Brut Royal  750 CC;Bebidas-con-alcohol;87.000,48
Leche Chocolatada ​La Serenísima Clásico 1lt;Lácteos;1.069,91
Levadura Fresca CALSA 50 Gr;Lácteos;95,76
Levadura Fresca Con Masa Madre Calsa 50 Grm;Lácteos;117,86
Leche Entera COTO Sachet 1 L;Lácteos;392,44
Leche Parcialmente Descremada COTO 1l;Lácteos;392,44
Leche Larga Vida Entera CIUDAD DEL LAGO Ttb 1 L;Lácteos;508,20
Leche Larga Vida Parcialmente Descremada CIUDAD DEL LAGO 1l;Lácteos;508,20
Leche Larga Vida Entera COTO Ttb 1 L;Lácteos;519,77
Leche Larga Vida Parcialmente Descremada COTO 1l;Lácteos;519,77
Ades Soja Sabor Frutilla 1 Lt;Lácteos;529,98
Ades Soja 1 Lt;Lácteos;530,04
Leche Reducida En Lactosa Sachet 1l;Lácteos;573,44
Leche Multidefensas 3% LA SERENISIMA Sachet 1l;Lácteos;573,44
Leche Multidefensas 2% LA SERENISIMA Sachet 1l;Lácteos;573,44
Leche Multidefensas 1% LA SERENISIMA Sachet 1l;Lácteos;573,44
Bebible LA SERENISIMA Vainilla 900ml;Lácteos;497,52
Jugo 100% Vegetal LA SERENISIMA Arroz Naranja 1lt.;Lácteos;588,32
Jugo 100% Vegetal LA SERENISIMA Arroz Manzana 1lt.;Lácteos;588,32
Leche Parcialmente Descremado Deslactosada Coto 1 Ltr;Lácteos;589,90
Leche P/Desc. Fort.C/Vit. A, Tregar Ttb 1 Ltr;Lácteos;660,15
Leche Larga Vida Entera TREGAR Ttb 1 L;Lácteos;660,15
Leche LA SERENISIMA Con Prebióticos 1l;Lácteos;665,17
Leche Protein La Serenisina Botella Larga Vida 1l;Lácteos;665,17
Leche Descremada Larga Vida Barista La Serenisima 1 Ltr;Lácteos;679,56
Leche Entera Larga Vida Lechelita 1 Ltr;Lácteos;688,09
Leche Parcialmente Descremada Lechelita 1 Ltr;Lácteos;688,09
Leche Larga Vida Entera VERONICA Ttb 1 L;Lácteos;733,67
Leche Larga Vida Descremada VERONICA Ttb 1 L;Lácteos;733,67
Bebida A Base De Almendras ADES Sin Azúcar 1lt;Lácteos;749,94
Yogur Bebible Sachet Manzana Y Frutilla ACTIVIA 1kg;Lácteos;758,33
Yogur Bebible Sachet Ciruela ACTIVIA 1kg;Lácteos;758,33
Leche Parcialmente Descremada Larga Vida Ilolay Ttb 1 Ltr;Lácteos;758,81
Leche Entera Larga Vida Ilolay Ttb 1 Ltr;Lácteos;758,81
Leche Larga Vida Parcialmente Descremada LA SERENISIMA 2% 1l;Lácteos;825,48
Leche Larga Vida Parcialmente Descremada Liviana 1% La Serenisima 1l;Lácteos;825,48
Leche Larga Vida Entera Ua Clasica 3% La Serenisima 1l;Lácteos;825,48
Leche P/Desc. 0% Lactosa Tregar Ttb 1 Ltr;Lácteos;768,40
Leche Entera Larga Vida Uat 3% Tres Niñas 1l;Lácteos;774,71
Leche Descremada Larga Vida Uat 0% Tenor Graso Las Tres Niñas 1l;Lácteos;774,71
Leche Parcialmente Descremada Uat 1% Tres Niñas 1l;Lácteos;774,71
Leche Entera Larga Vida Uat 2% Las Tres Niñas 1l;Lácteos;774,71
Yogur Bebible Parcialmente Descremado Sabor Vainilla Gran Compra 900g;Lácteos;700,38
Yogur Bebible Parcialmente Descremado Sabor Frutilla Gran Compra 900g;Lácteos;700,38
Bebida Láctea LA SERENISIMA Bebible Frutilla 1l;Lácteos;784,90
Bebida Láctea LA SERENISIMA Bebible Vainilla 1l;Lácteos;784,90
Bebida Láctea LA SERENISIMA Bebible Frutilla 1l;Lácteos;784,90
Bebida Láctea LA SERENISIMA Bebible Vainilla 1l;Lácteos;784,90
Bebida A Base De Almendras Ades 1lt;Lácteos;795,11
Leche Chocolatada ILOLAY 1l;Lácteos;816,85
Leche Chocolatada Shake Con Vitamina A SANCOR 1l;Lácteos;889,88
Leche Larga Vida Parcialmente Descremada 0% Lactosa Las Tres Niñas 1l;Lácteos;847,54
Leche Entera Clasica LA SERENISIMA Botella Larga Vida 1l;Lácteos;919,20
Leche Parcialmente Descremada Liviana LA SERENISIMA Botella Larga Vida 1l;Lácteos;919,20
Leche Zero Lactosa LA SERENISIMA Botella Larga Vida 1l;Lácteos;856,01
Yogur Bebible Descremado Vainilla Tregar 900 Grm;Lácteos;790,84
Yogur Bebible Parcialmente Descremado Vainilla Tregar 900 Gr;Lácteos;790,84
Yogur Bebible Descremado Frutilla Tregar 900 Gr;Lácteos;790,84
Yogur Bebible Parcialmente Descremado Sabor Frutilla Tregar 900gr;Lácteos;790,84
Leche Chocolatada San Ignacio Ttb 1 Ltr;Lácteos;896,30
Yogur Bebible Parcialmente Descremado Arándano Tregar 900 Grm;Lácteos;808,41
Yogur Bebible Parcialmente Descremado Durazno Tregar 900 Grm;Lácteos;808,41
Bebida Láctea LA SERENISIMA Sense Caramel 1 L;Lácteos;913,72
Leche Clásica Mas Liviana LA SERENISIMA Botella Larga Vida 1l;Lácteos;916,59
Leche Descremada Menos Calorias LA SERENISIMA Botella Larga Vida 1l;Lácteos;916,59
Leche Extra Calcio La Serenisina Botella Larga Vida 1l;Lácteos;921,86
Leche Chocolatada TREGAR 1l;Lácteos;940,80
Levadura Seca CALSA Mi Pan 10 Gr;Lácteos;96,30
Yogur Bebible Entero Vainilla 0% Lactosa Milkaut 900g;Lácteos;939,96
Yogur Bebible Entero Frutilla 0% Lactosa Milkaut 900g;Lácteos;939,96
Bebida A Base De Almendras ADES Almendras Con Vainilla 1lt;Lácteos;982,56
LA SERENISIMA 100% Vegetal Almendra Sin Endulzar 1l;Lácteos;1.065,11
Yogur Bebible Descremado Sabor Vainilla Milkaut 900g;Lácteos;889,92
Yogur Bebible Descremado Sabor Frutilla Milkaut 900g;Lácteos;889,92
Yogur Bebible Descremado Vainilla SANCOR Vida 900g;Lácteos;901,59
Leche Chocolatada TREGAR Ttb 200 CC;Lácteos;217,97
Levadura Seca LEVEX 10 Gr X 2 Unidades;Lácteos;204,20
LA SERENISIMA 100% Vegetal Almendra 1l;Lácteos;1.062,08
Yogur Bebible Sabor Frambuesa Y Limon Milkaut 900g;Lácteos;1.035,21
Bebida Vegetal Coco Sin Endulzar La Serenisima 1l;Lácteos;1.096,00
Bebida Vegetal NOT MILK Chocolate X 1 Lt;Lácteos;1.205,76
Leche Descremada Larga Vida Protein Sabor Chocolate LA SERENISIMA Ttb 1l;Lácteos;1.153,41
Yogur Bebible Vainilla La Serenísima Clásico 900gr;Lácteos;1.042,20
Yogur Bebible Descremado Frutilla La Serenísima Clásico 900gr;Lácteos;1.042,20
Yogur Bebible Descremado Vainilla La Serenísima Clásico 900gr;Lácteos;1.042,20
Yogur Bebible Durazno La Serenísima Clásico 900gr;Lácteos;1.042,20
Yogur Bebible Frutilla La Serenísima Clásico 900gr;Lácteos;1.042,20
Bebida Vegetal NOT MILK Original X 1 Lt;Lácteos;1.163,96
Leche Chocolatada LAS TRES NIÑAS 1l;Lácteos;1.199,38
Yogur Bebible Entero MILKAUT Sabor Frutilla 1kg;Lácteos;1.088,37
Yogur Bebible Entero MILKAUT Sabor Vainilla 1kg;Lácteos;1.088,37
Yogur Entero MILKAUT Durazno Bebible 1 Kg;Lácteos;1.088,37
Yogur Bebible Entero Vainilla Sancor Yogs 1kg;Lácteos;1.301,53
Yogur Bebible Entero Frutilla Sancor Yogs 1kg;Lácteos;1.301,53
Bebida A Base De Mani, Sabor Or Vivet Ttb 1 Ltr;Lácteos;1.305,58
Yog.Beb. Ent. Fort. Vai Milkaut Sch 1250 Kgm;Lácteos;1.536,07
Yog.Beb. Ent. Fort. Fru Milkaut Sch 1250 Kgm;Lácteos;1.536,07
Leche Chocolatada ​A Base De Almendras Y Cacao CINDOR 1lt;Lácteos;1.316,71
Leche Chocolatada Sabor Mocha CINDOR 1lt;Lácteos;1.316,78
Leche Chocolatada ​Cindor 1 Lt;Lácteos;1.316,81
Yogur Bebible Deslactosado Frutilla La Serenísima Clásico 900gr;Lácteos;1.198,50
Yogur Bebible Deslactosado Vainilla La Serenísima Clásico 900gr;Lácteos;1.198,50
Yogur Entero ILOLAY Frutilla Bebible 1kg;Lácteos;1.218,00
Yogur Descremado ILOLAY Frutilla Bebible 1kg;Lácteos;1.218,00
Yogur Entero ILOLAY Vainilla Bebible 1kg;Lácteos;1.218,00
Yogur Bebible Parcialmente Descremado Frutilla Kiwi Ilolay 900 Gr;Lácteos;1.218,00
Yogur Descremado ILOLAY Durazno Bebible 1kg;Lácteos;1.218,00
Yogur Descremado ILOLAY Vainilla Bebible 1kg;Lácteos;1.218,00
Bebida A Base De Mani, Sabor Va Vivet Ttb 1 Ltr;Lácteos;1.465,61
Bebida A Base De Mani, Sabaor C Vivet Ttb 1 Ltr;Lácteos;1.357,05
Bebida Vegetal De Maní Y Almendras Amande 1 Ltr;Lácteos;1.469,55
Bebida Vegetal A Base De Maní Sabor Chocolate La Serenisima 1l;Lácteos;1.419,47
Leche Chocolatada 50% Más Cacao CINDOR 1lt;Lácteos;1.448,39
Leche Chocolatada ILOLAY Ttb 200 CC;Lácteos;312,92
Yogur Bebible Descremado Sabor Frutilla Lechelita 900g;Lácteos;1.325,35
Yogur Bebible Entero Sabor Frutilla Lechelita 900g;Lácteos;1.431,38
Yogur Bebible Descremado Sabor Vainilla Lechelita 900g;Lácteos;1.325,35
Yogur Bebible Entero Sabor Vainilla Lechelita 900g;Lácteos;1.325,35
Yogur Essential Parcialmente Descremado Frutos Rojos​ Con Cereales SER 158gr;Lácteos;239,79
Yogur Descremado Firme Endulzado Sabor Vainilla Gran Compra 120g;Lácteos;182,33
Yogur Cremoso Descremado Sabor Vainilla Gran Compra  120g;Lácteos;182,52
Yogur Cremoso Descremado Sabor Frutilla Gran Compra 120g;Lácteos;182,52
Yogur Bebible Tetrabrik Frutilla YOGURISIMO 1kg;Lácteos;1.563,34
Yogur Bebible Tetrabrik Vainilla YOGURISIMO 1kg;Lácteos;1.563,34
Ricotta Con Crema Silvia X 500 Grm;Lácteos;787,45
Yogur Bebible Con Probioticos Parcialmente Descremado Sabor Frutilla Yogurisimo 1100g;Lácteos;1.735,50
Yogur Bebible Con Probioticos Parcialmente Descremado Sabor Vainilla Yogurisimo 1100g;Lácteos;1.735,50
Grasa Bovina Doña Flora 500 Grm;Lácteos;861,68
Yogur Entero Firme Vainilla Sancor Yogs Pak 250 Grm;Lácteos;452,02
Yogur Parcialmente Descremado Sabor Frutilla Tregar 125 Grm;Lácteos;210,81
Yogur Parcialmente Descremado Sabor Dulce De Leche Tregar 125 Grm;Lácteos;210,81
Yogur Parcialmente Descremado Sabor Vainilla Tregar 125 Grm;Lácteos;210,81
Yogur Descremado Fortificado Vainilla Tregar 125 Gr;Lácteos;210,81
Yogur Descremado Sabor Frutilla Tregar 125 Grm;Lácteos;210,81
Bebida Vegetal De Almendras Liviano Amande 1 Ltr;Lácteos;1.822,25
Bebida A Base De Almendras Sabor Chocolate Endulzada SILK 1lt;Lácteos;1.693,57
Bebida A Base De Almendras S/Azúcar SILK 1lt;Lácteos;1.693,57
Bebida A Base De Coco Silk 1l;Lácteos;1.693,57
Bebida A Base De Almendra Vainilla Sin Azúcar Silk 1l;Lácteos;1.693,57
Bebida A Base De Almendras Endulzada SILK 1lt;Lácteos;1.693,57
Bebida A Base De Coco Sin Azucar Silk 1l;Lácteos;1.693,57
Yogur Bebible Entero Sabor Frutilla Yogs 900g;Lácteos;1.649,83
Yogur Colágeno Bebible Vainilla SER 900gr;Lácteos;1.535,76
Yogur Colágeno Bebible Vainilla SER 1kg;Lácteos;1.535,76
Alimento Lacteo Sabor Frutilla La Serenisima 85g;Lácteos;145,50
Alimento Lacteo Concentrado Sabor Vainilla La Serenisima 85g;Lácteos;145,50
Yogur Batido Sin Lactosa Frutilla La Serenísima Clásico 120gr;Lácteos;225,83
Yogur Essential Batido Parcialmente Descremado Vainilla SER 140gr;Lácteos;244,33
Leche Entera Larga Vida 3% Clásica La Serenísima 200 Ml;Lácteos;351,23
NIDINA 2 Listo Para Tomar X 200ml;Lácteos;352,63
Yogur Entero Firme Sabor Frutilla Lechelita 160g;Lácteos;306,36
Yogur Entero Firme Sabor Vainilla Lechelita 160g;Lácteos;306,36
Yogur Bebible Entero Sabor Vainilla Yogs 900g;Lácteos;1.728,40
Levadura Fresca CALSA 50 Gr X 2 Unidades;Lácteos;178,42
Yogur Cremoso Descremado Light Frutilla Milkaut Pot 190 Grm;Lácteos;345,87
Yogur Cremoso Descremado Light Sabor Vainilla Milkaut Pot 190 Grm;Lácteos;345,87
Yogur Batido Descremado Frutilla La Serenísima Clásico 120gr;Lácteos;225,71
Yogur Batido Descremado Vainilla La Serenísima Clásico 120gr;Lácteos;225,71
Yogur Batido Frutilla La Serenísima Clásico 120gr;Lácteos;225,81
Yogur Batido Durazno La Serenísima Clásico 120gr;Lácteos;225,81
Yogur Batido Vainilla La Serenísima Clásico 120gr;Lácteos;225,81
Yogur Firme Vainilla La Serenísima Clásico 120gr;Lácteos;225,81
Yogur Firme Frutilla La Serenísima Clásico 120gr;Lácteos;225,81
Bebida A Base De Castañas Origi Vivet Ttb 1 Ltr;Lácteos;1.940,40
Dulce De Leche COTO 400g;Lácteos;779,00
Grasa Bovina RECIENTO 500g;Lácteos;979,99
Grasa Porcina RECIENTO 500 Gr;Lácteos;979,99
Leche Chocolatada ​La Serenísima Clásico 200ml;Lácteos;423,95
Bebida Vegetal De Coco Y Almendras Amande 1 Ltr;Lácteos;2.124,59
Yogur Bebible Sabor Durazno Yogurisimo 900g;Lácteos;1.789,15
Yogur Bebible Frutilla YOGURISIMO 900gr;Lácteos;1.789,15
Yogur Bebible Vainilla YOGURISIMO 900gr;Lácteos;1.789,15
Alimento Lacteo Sabor Macchiato Sense 200 Ml;Lácteos;398,13
Alimento Lacteo Sabor Cappuccino Sense 200 Ml;Lácteos;398,13
Alimento Lacteo Sabor Caramelo Sense 200 Ml;Lácteos;398,13
Dulce Leche Repostero COTO 400g;Lácteos;799,00
NIDO 3 Defensas Leche Infantil Listo Para Tomar X 200ml.;Lácteos;420,07
Dulce De Leche Lechelita 250g;Lácteos;549,50
Bebida A Base De Castaña Con Ch Vivet Ttb 1 Ltr;Lácteos;2.058,00
Yogur Firme Descremado Frutilla La Serenísima Clásico 190gr;Lácteos;398,29
Yogur Firme Vainilla La Serenísima Clásico 190gr;Lácteos;398,29
Yogur Firme Descremado Vainilla La Serenísima Clásico 190gr;Lácteos;398,29
Yogur Firme Frutilla La Serenísima Clásico 190gr;Lácteos;398,29
Yogur Peppa Pig Bebible Vainilla ​Danonino 100gr;Lácteos;210,33
Yog.Bat.Ent.Cremos Vainilla Sancor Yogs Pot 240 Grm;Lácteos;552,37
Dulce De Leche Clasico Veronica 250g;Lácteos;575,88
Yogur Bebible Frutilla Reducido En Azúcar YOGURISIMO 900g;Lácteos;1.927,11
Leche Chocolatada Leche Con Cacao Tres Niñas 200ml;Lácteos;430,51
Yog.Ent.Firme Frutilla Sancor Yogs Pot 190 Grm;Lácteos;445,23
NAN Optipro 3 X 190ml;Lácteos;457,33
Bebida Vegetal De Almendras Amande 1 Ltr;Lácteos;2.242,13
